;Stemming
2002;sehat sehat anak perempuan sandwich generation got your
2004;kait tapera gemas lihat ngeluh karyawan swasta gaji umr kota rekruitment single sandwich generation nyicil rumah bensin tanggung kantor gemas ughaaa
2008;posisi sandwich generation berat uang gaji pakai bangun rumah keluarga butuh tahun lega sesuai rumah selamat iya kakak intan
2009;sehatsehat sandwich generation adik mau
2010;cerita kerja bahagiain keluarga iya jatuh sandwich generation usaha ikhlas menuhin butuh keluarga bayar tagih utang nabung biar bangun rumah
2011;moga phk segeera kerja sandwich generation semangat
2014;kamu single keluarga barang reward muda manusia tau nama sandwich generation
2016;middle kelas cukup alami sandwich generation
2017;ngandelin uang gaji sandwich generation
2018;gusti lapang dada anak perempuan sandwich generation
2020;ibu pensiun pegawai negeri sipil guru pikir pegawai negeri sipil salah financial rencana beliau jadi anakanak beliau sandwich generation beliau pensiun tertawa pikir terimakasih ibuuk
2021;bahagia eh dewasa kerja uang habis urus dapur token listrik keluarga nyala anakanak broken rumah sandwich generation
2022;gila nasib sandwich generation tawa karirsampemaunangis
2023;tanya orang giat tabung faktor bermacammacam sandwich generation tau atur uang faktor
2024;sandwich generation tanggung finansial consider aju resign kerja keras bagus bagus kerja nyaman suportif sehat mental fisik
2025;lambat living kamus sandwich generation nature shape achieve more more more choice titik peduli mental health dalam sendiri malam orang
2027;sehat sehat anak sandwich generation
2028;isokayyy orang tua baik kecil sandwich generation buruk besar
2029;sedih kuliah orang tua hilang jaya enggak mau lulus sandwich generation
2030;semangat sandwich generation level negara
2031;uji ekonomi nikah sandwich generation gaji segitu asih orang tua nabung duga
2033;mindswt terap hapus sandwichsandwich generation
2034;anak perempuan sandwich generation cant hubung
2036;son sandwich generation iya tertawa bagus pikir mertua son atlet sukses good attitude
2038;orang tua gadis lelaki ekonomi stabil sandwich generation karier putus hubung perempuan tunggu handle sedih adik down tertawa dah
2039;amin semangat tulang punggung keluargasandwich generation
2040;hoo jancuk kecuali koe sandwich generation rasah cangkeman tanggung iku pilih wkwkwkwk
2041;sandwich generation mari berkumpulsemoga gusti allah maringi kuat yaaak
2042;orang tua anak sandwich generation
2044;tulang punggung sandwich generation kakak
2045;realita sandwich generation tanggung beban
2047;iya pagi temenku whatsapp pinjam uang eh pagi ege pinjam uang begimane sayang gaji uang pegang tinggal dikit sandwich generation uang bagi doang
2048;suami sandwich generation meni adeknya kerja mental kuat suami dikit hilang keluarga ujung iya suami nyelesaiin
2049;hts paja sandwich generation tertawa
2051;sandwich generation pilih cere anjing anjing tau cere uang hasil kerja tahi
2052;jam gulir orang orang moots moots kpopies uang waris rintis sandwich generation langsung mikir cari uang pakai gaya biar dompet nyaman jasa kpopies
2053;dapat pelit tanggung gatel sandwich generation menclamencle setir keluarga
2054;anak sandwich generation awowww aduh ngtot
2056;sumpah kesal sandwich generation keluarga duit bingung uang
2057;wih admin ikut bahagia baca cerita seabank percaya nabung lamalama bukit moga sandwich generation inspirasi kakak tabung iya
2058;pikir nabung nyaman keluar duga datang bertubitubi sama semangat sang tulang punggung keluarga sandwich generation fall harder stand higher come stronger
2059;uji sandwich generation selesai eh uji kontrak kerja habis semangat
2062;rasai ngontrak rumah sandwich generation enteng omong birokrasi
2063;temenku eksten universitas indonesia dalem hati sandwich generation subsidi orang tua
2064;asi value ngewajarin dinasti politik keluarga asi value mengeneralisasi sandwich generation
2065;bahas teman kantor kiwi bilang indonesia umur an sandwich generation uang pikir tua duit pakai urus orang tua urus anak gelenggeleng kaget istilah sandwich generation
2066;sandwich generation kakak gaya hidup hedon gaya hidup hedon mending atur ulang budgeting
2068;lepas jerat sandwich generation puji syukur gaji potong
2069;tau generasi tua katai gen lemah cupu gara demo doang gen anak kelas tengah juang sandwich generation
2072;mangat yaw sandwich generation asih orang tua sedekah tanggung
2073;kasihan sandwich generation utang nanggung
2074;pagi cerah minggu ah beli sepatu entitas darimana sepatu rusak volly tanggal sandwich generation routines
2075;sakit orang tua tengkar kisah cinta babi sandwich generation anak perempuan
2076;asi value manusia rights lontar sandwich generation asi value dinasti politik hmmmm asi value
2077;asi value sandwich generation dinasti politik asi value tertawa
2078;sandwich generation juang iya lingkar setan
2079;bilang jebak sandwich generation merhatiin kagak minta
2080;berat iya sandwich generation suruh tulang punggung keluarga kasihan papa kesal kerja biayain kasih makan iya kepala fam buset
2081;iya mikir orang tua biar anak sandwich generation egois lingkung normalisasi anak wajib asih orang tua asih dianggep enggak bisa balas budi orang tua
2082;anggur sandwich generation banyak istigfar az
2083;kombinasi sandwich generation kerja middleincome millenia
2084;generasi sandwich kali muncul jurnal karya dorothy miller profesor direktur praktikum universitas kentucky lexington amerika serikat judul sandwich generation adult children of aging
2085;asli funnn sandwich generation adik pikir
2086;sandwich generation caregiver bertahuntahun pilih reward mahal saranopini tulis dengar heartless
2087;kelola uang rajin tabung rintis hidup sederhana level gaya hidup oh iya sandwich generation sumber hasil amat
2088;alami orangtua sandwich generation kekang untung iman kuat syukur tahan apa situasi
2089;banyak syukur menang hidup layak minimal penuh mamasemangat sehatsehat sandwich generation
2090;self healing baca sandwich generation jalur saudara peka alhamdulilah beli basic skin peduli tabung cadang
2092;anjing sandwich generation gotong royong
2093;pokok rumah broken insya allah ulang hidup anak gejala depan bikin anak sandwich generation atas kasihan anak
2095;sandwich generation hak bahagia menghamburhamburkan uang hasil kerja keras senang
2097;generalisasiin sandwich generation ganti miskin generasi kakek orang tua hidup layak sandwich generation orang indonesia
2098;tunggu sandwich generation pakai sandwich generation generasi orangtua kakek masalah layak hidup
2099;tips siapin dana nikah ala sandwich generation siap dana darurat danastra aman percaya klik link bayar angsur mudah aplikasi astrapay telpon whatsapp
2100;sesak sandwich generation hasil nabung kebel rumah biayain anggota keluarga ujung bantuin orang kenal aset bpjs konsep gotong royong rasai manfaat
2102;didik gratis keluarga sarjana peluang bentuk sandwich generation enggak pilih mending benar naikin produktivitas
2103;umur an susah nabung tidak tahu settle sandwich generation
2104;nama pensiun ngandelin apauang pensiuntabungan itu maksimal dukung anak anak kerja keras capai cita kerja keras nikah segar lulus butuh dukung orang tua syukur sandwich generation
2106;sandwich generation capek iya semangat teman lupa kebahagian bahagia
2107;jokes pagi kakak ndra yun sandwich yun sandwich generation wkwkwkwkwk
2108;wangxingyue wujinyan beda wangxingyue aura om matur wujinyan aura anak cewek sandwich generation pundak kuat rock chemistrying hard tensioning hard ketemu durasi detik alias dikit
2109;konsep bodoh kerja mrnghidupi orang mah kesal sandwich generation keluarga negara paksa nanggun hidup orang
2110;bilang beban beban allah sandwich generation month target cari solusi biar hit alias achieve yasudah keluarga diandelin butuh belakang allah
2111;pdkt pelit hitung sendirinamaste kondisi gaji okey sandwich generation pelit hemat inti gaya sesuai mampu gaya hidup
2113;susah iya bilang orang tua kolot urus sim pakai calo urus biaya murah sandwich generation nanggung biaya orang tua suruh urus jalur resmi enggak mau
2114;ngeberantas marak kalang middle kelas worker sandwich generation harap gajadi beban turun
2115;bangkai kerja suruh sekolah adik suruh mnjd sandwich generation
2117;sandwich generation isi kepala ledak ledak
2118;resmi ikhlas bakti sandwich generation bismillah moga ikhlas depan allah titip rezeki keluarga amin
2119;tua ngontrak lahir anak sandwich generation
2120;nabung invest dsb dishare influence indonesia susah diterapin kerja gaji digit sandwich generation tambah disclaimer iya gaji digit tambah uang ngonten sandwich generation
2121;kala asih reward biar kerja semangat semangat sandwich generation
2122;pikir selesai sandwich generation biar nikah tenang tertawa
2123;orphanage budaya budaya sandwich generation
2126;hutang orang tua biaya adik sekolah hidup sandwich generation
2128;budaya indonesia mah sandwich generation iya
2130;sandwich generation pond duda anak tukang pipa kakak
2131;pond teman gen sandwich generation aktor kerja barista cafe jejepangan thailand family man alias anak prioritasin keluarga positive energy minimal camat kakak
2132;dibandingin tinggal orang tua hehew iya beda vs sandwich generation
2133;gaji bayar tagih listrik wifi dsb lepas sandwich generation bulan kesal
2135;kerja kena tekan cc mah lulus kerja sandwich generation
2137;tips golong nista ppds uang sandwich generation ambil puskesmas habis sip sisa kerja rodi gila puskesmas ppds uang orkay ambil rsud gampang kasih rekomenampbanyak kasus
2138;pusing sandwich generation satu sisi bakti sisi rasai tabung
2139;beban anak golong sandwich generation berat pikir orang penting gaji juta kurang beban mental
2140;situasi keluarga harmonis cemara finansial keluarga aman gaji juta finansial keluarga sesuai pas anak golong sandwich generation ambil option beban
2141;lagu anthem pergi kerja manusia sandwich generation
2142;sandwich generation ceramah butuh orang
2143;senang bentar gaji senang gaji dadak senang anak sandwich generation
2144;alhamdulilah masuk juni lega dikit keluar uang sehatsehat anak perempuan sandwich generation moga jodoh anak tunggal raya hehehe
2147;iya allah bikin atur orang gaji tabung sandwich generation biaya keluarga
2148;anak jadi investasi orang tua doang iya tertawa pakai hashtag sandwich generation
2149;brengsek perintah udahny sandwich generation
2150;gaji juta rumah pusing apalagj sandwich generation
2151;gantung lingkung rumah orang tua orang erti omong sandwich generation sindir mending keluarga gaji juta lingkung toxic sandwich gen run
2154;keluarga alhamdulilah ngebebanin anak sandwich generation asih nurunin aset impas lahir dewasa
2155;gitu doa moga turun tidak ada sandwich generation makmur sukses bahagia dunia akhirat
2156;saat bilang sandwich generation selai kacang iya tolong
2158;bayang gaji juta potong bayar bpjs bayar listrik air uang makan keluarga sandwich generation kayak niat perintah kurang populasi duduk dorong bunuh diri masal
2159;sehatsehat sandwich generation privilege moga tuhan asih tolong saat cekik
2161;confront beliau sejahtera keluarga tuntut sandwich generation ganti kakak pensiun kah kesal kabur
2162;perlahan konsep let flow challenge challenge duga semangat sandwich generation
2163;suami sandwich generation max korban nafkah keluarga asuh kasih sayang layak orang tua moga allah senantiasa kucur rezeki limpah
2164;jeno jeno katholik tolong agama kemanusian sedih lihat anak anak gbbisa makan enak sandwich generation
2166;terimakasih kakak saran hati psikolog apa daya sandwich generation obat tanggung bahagia
2167;semangat sandwich generation tantang banyak orang bantu coba laku halhal atas situasi buat anggar uang catat keluar pasu susun anggar realistis
2170;anak muda indonesia sibuk urus kerja mana sibuk sandwich generation sibuk mikir cicil motor berangkat kerja sibuk pikir bayar kuliah pakai pikir gubernur kagak
2171;pribadi kelak tinggal dua istri rumah sendiripanti jompo goal putus sandwich generation tanggung orang tua tutut tanggung
2172;sandwich generation keluarga gencet negara hadehhhhh sedih kali warga kelas tengah
2174;orang indonesia kasihan dipajakin mana pajak banding eropa dampak minim kena sandwich generation judge kirim orang tua panti jompo salah lucu
2175;pinjam kiri kanan bayar sekolah anak sandwich generation golong
2176;teman teman sandwich generation ngerantau keluarga bilang tidak tahu enggak pernah ngehubungin sekali ngehubungin uang curhat kesal muak sender semangatin
2177;cantik sexy didik mandiri keluarga cemara sandwich generation tebak dapat
2178;bakti orangtua keluarga masuk sandwich generation iya
2179;lumayan peristiwa jleb financial planning training bos dept bawain materi sesuai bahas expenses smpet sandwich generation angkat tangan whole grup krg bas orang
2180;kadang mikir umr orang dibagibagi keluarga sandwich generation kakak
2181;tum isi berat beban anak sandwich generation punggung nyaman cocok manusia bawa barang berat
2182;sehat sehat sandwich generation kuat
2183;sandwich generation anak satusatunya urus orang tua urus kerja urus keluarga pikir this lot mikir ngerelain meni tugas
2186;semangat senderrr tidak apa kokk terburuburu nikah butuh disiapin fisik finansial mental pikir pikir nikah omong keren mangatss juang sandwich generation
2187;wes sandwich generation jancuk bajilak tenan
2188;kisah sandwich generation variatif tingkat case sengaja tertawa
2189;iya syukur sandwich generation pihak ortuku iya sadar mau urus orang tua caregiver sadar anak adekku sadar moga ros
2190;anak amanat jaga orang tua sulit ekonomi sandwich generation hong kong asih subsidi rawat orang tua rumah gampang
2192;tau nganggur negative vibes tulang punggung keluarga sandwich generation ngalami cut mati kerja tahan kerja saran kakak
2193;sandwich generation ver biaya keluarga biaya orang tua biaya adik biaya perintah
2195;bagus dana pensiun pegawai non perintah biasa konsumtif sulit tabung tabung duduk indonesia bawah juta rencana haritua cipta sandwich generation sistemik turun turun
2197;beban berat hutang jatuh takdir salah generasi sandwich generation anak lelaki satu sdr prmpuanya rasacukup tau nikah sanggup pasanganya
2198;anak taperamu anak asuransi anak deposito jangka mari putus siklus sandwich generation dasar paksa mari pupuk generasi beban tua asuh lansia cinta
2199;sandwich generation gaji umr berita
2201;budaya indonesia daya sandwich generation
2202;sandwich generation disalahsalahin beli rumah tiwas metizen geger belah ngontrak beli kpr jebul tagih beli
2203;iya ih milenial gen susah upah paksa sandwich generation
2204;realistis pikir kayak nabung gila uang muka kejar juta kejar gaji gitu juta tenor biaya sandwich generation skema potong ponzi sesuai gilir eh program hapus uang hangus
2205;sehatsehat bani sandwich generation gaji syukur umr dikit nabung dikit syukur iya tidak apa butuh seharihari cicil cukup
2206;nyata hidup aneh yonsu independent sandwich generation mandiri satu cowok model choi ung antem beda prinsip
2207;anak urus orang tua bakti orang tua serahin orang tua panti jompo sandwich generation mau disusahin orang tua
2208;iya ngerawat orang tua mudah sifat kadang ngeyel nemenin kerja kesal budaya indonesia sandwich generation iya
2209;would never same kayak lulus cepat kerja sandwich generation
2210;budaya panti jompo sandwich generation
2211;kuliah kerja bayar kuliah sandwich generation gila gila pikir nyicil motor backingan
2212;argumen salah paksa siap pensiun kasihan orang usia pensiun beban turun terus cipta sandwich generation dukung
2213;menteri booomer cepat punah bangsat mindsetnya kolot dikit dikit budaya indonesia apa budaya indonesia malak fenomena sandwich generation pelihara muda muda mah susah cari uang diwajibin urus lansia langsung
2214;genosida palestina ruu siar iur tapera mah susah hidup zaman edan pribadi judul proposal sandwich generation tekan hidup gen sehatsehat gen moga tahan dunia sulit
2215;sandwich generation gaenak kerja pagi malam gaji lumayan habis gaji hadeuhhhh
2216;tolak konsep panti jompo sedih pikir bikin konsep daycarenursing rumah layak sandwich generation cari nafkah hati tentram tau orgtua aman nyaman tinggal
2217;admin minat bikin tapajo tabung panti jompo biar tua ngerepotin anak cucu kelak tinggal panti jompo layak potong gaji putus rantai sandwich generation
2218;prettt wegah mbayari sekolahe og uwong penak tenan tolak sandwich generation alas sekolah sds gratis iso kon mbayari sekolah anjing
2219;dientod bijak perintah hidup kuliah semester sandwich generation
2221;budaya sandwich generation turun turun bansos laris manis
2222;takut adulting takut sandwich generation takut dewasa enggak punya hobi enggak punya iri tau orang orang umur senang neng ngehobi berprivilege tampar realita cari kerja tanggung keluarga ekspektasi capekkkkkkk
2223;sip mari budaya sandwich generation budaya modern anggap budaya negara kocak kembang
2225;wow tahap diceramahin ngebahas suruh bantu ekonomi keluarga sksksksk hidup sandwich generation
2226;gaji umr indonesia rata contoh lampung umr juta orang ngekos makan nasi garem doang sandwich generation
2227;sandwich generation feedbacknya diinjekinjek istri dighibahin sodara tau apaapa
2228;lelah sandwich generation tips orang ikhlas generasi
2231;apresiasi umur gaji bantu penuh butuh keluarga asih bulan nabung dikit gapapa ndre proses sandwich generation guna keluarga
2232;salah terbit grasindo favorit jatuh buku dompet sepatu suka zenna asrul sandwich generation lelah juang keluarga kagum wml
2233;gaji paspasan sandwich generation potong tapera pusing atur uang
2234;kasihan sandwich generation biayain sekolah serba mahal bahan pokok buruh kontrak kerja pendek perintah hobi malak rakyat
2235;hidup sandwich generation ngosngosan potong
2236;kelas tengah banyak sandwich generation tanggung beban keluarga orang tua saudara tambah beban negara kaum juang negeri
2237;sandwich generation kakak bayarin utang wkowkwok
2239;lupa hitung asa rakyat tengah karyawan gaji pas hak terima subsidi hitung miskin cicil utang potong mesti dibyr tanggung orang tua sandwich generation
2240;mah paksa sandwich generation negara
2242;sandwich generation keluarga sandwich generation masyarakat
2243;anak sandwich generation kakak syukur hidup anugerah serah
2244;sandwich generation menang darah pojok
2246;bantu lunasin hutang keluarga lelah sandwich generation
2247;uang sandwich generation uang tinggal ribu dompet atm habis keluar asih hasil beliau
2249;harta mending waris harta bikin sandwich generation
2250;indah hidup urus balita marah mama another sandwich generation mah
2251;ghea indrawari bikin lagu survei sandwich generation kah lagu bikin menang
2252;umur sandwich generation simpan uang beli tanah rumah habis bikin usaha an usia segitu gaji umr
2253;keren kakak sandwich generation susah nabung doain cepat lepas gelar sandwich generation moga ortuku rezeki
2254;definisi muda tampan raya beban sandwich generation wkwkwkwk
2256;habis habis tertawa juni idul adha sehat sehat sandwich generation lupa waras iya
2257;kisar juta oke mnrt teman sandwich generation
2258;ketemu mah juang suka omong cowok sandwich generation sadar cewek naluriah bantu bilang cap duluan hitung an
2259;lihat semangat tabung orang simpan semangat sandwich generation
2260;pilar hidup gadis sulung early twenty anut sandwich generation anger issue
2261;ketemu gadis sek ketemu gadis tangguh coba kenal gadis sandwich generation
2262;semangat kakak gadis sandwich generation adik cowok sabar this shall pas
2263;senang sender umur halang capai berat sandwich generation gapapa semangat
2264;ampun suhu cicil sandwich generation
2265;nuna sandwich generation iya adik keponakan butuh uang eh anak lulus ajak kenal
2266;tidur peliz tidur mah besok musti nguli pagi pagi mah sandwich generation musti ngebiayain hidup tapiii teh modol teu sare menang
2268;gakmau iya mantu sandwich generation
2270;suka sandwich suka sandwich generation
2271;enggak mau sandwich generation kesal biayain orang
2272;selamat sender moga sandwich generation nabung
2274;anak muda keluar tanggung come nyala selamat datang sandwich generation kakak
2276;anak muda gratis sandwich generation kasih sambel mulut tertawa
2277;cukup kakak iya tau ekonomi pas tahan beli hidup sandwich generation opini jelek kakak
2279;salah hidup susah sandwich generation hangout pikir kasihan jomblo orang tolong
2280;bahagiain orangtua vs bahagiain sandwich generation hubung iya bahagia pribadi korban prioritas utama niat ikhlas rsa beban muncul kdu pye
2281;sandwich generation benci pales bodoh kerja ngerokok tidur makan puki mending mati cpek anjing
2282;orang tua privilege enough rasai sandwich generation orang tua jajanin bocil sodara kandung suka languagenya asih surprise skincare baju parfum name pulang kampung jemputantar bandara
2283;sandwich generation cari uanng iya ngejaga acr langsung iya merhatiin makan iya ngerusak tubuh blkg sia
2284;bos pahlawan lupa sandwich generation halo keluarga mahasiswa upnvj lupa apresiasi kuat hadap generasi sandwich pahlawan keluarga sungguh
2285;benar privilege nyata syukur orang breadwinnersandwich generation tertawa kemarin habis catch teman kantor mantan teman kantor senang cerita
2288;sesuai cari jamet bonus jametnya zara vernon emo version senang birthday anak kicikkkkk teman sempat ketemu xixi tapiii moga salto era gempur sandwich generation
2289;fucked fucked sandwich generation sandwich generation hidup orang gila konsep meni this economy ra masuk moga allah bantu iya
2291;papa anak admin tolong bantu sandwich generation admin
2292;teman posisi sandwich generation depression hati coba dengar lagu judul cheers youth seventeen tolong lagu bagus official mv
2293;pikir negatif sandwich generation kadang orang tua egois pikir uang uang uang sakit orang tua erti diri sepenuh erti
2294;cheers youth salah lagu playlist sesuai otw kerja disemangatin lagu svt kayak stres berat hadap hidup sandwich generation terimakasih iya
2295;sandwich generation kerja outdoor ngangkat beban puluh kilo lawan stigma gender
2296;linting tembakau saus samyang wih pribadi tahan banting anak tuntut sandwich generation matimatian kursus vokal idol tenggorok kadang kering kerontang serakserak basah salut
2297;pilih nunda anak childfree putus lingkar sandwich generation
2298;indonesia terap siswa loan orangorang cekik bunga iya habis lulus gaji sandwich generation siswa loan buka solusi biaya ukt
2299;moga putus lingkar sandwich generation
2300;habis lihat content creator ngitungin biaya siap negeri pakai lpdp habis juta bjir kelas kerja kelas tengah ngehe sandwich generation gaji umk butuh kerja kerja nyiapin
2302;hidup sandwich generation asa resign hidup
2304;sandwich generation gen frugal living background broken rumah koentji
2305;minimal juta tabung dua kerja sandwich generation anggap tinggal jawa tengah iya gaji dua gabung tabung butuh lihat pakai langsung tabung laku anak
2306;selagi muda banyak cari uang bnyakin bikin anak jadi anak sandwich generation mata rantai putus anak beban orang tua
2308;tahan emosi aslam jam stasiun telat bezingan kereta dokter obat begitu orang tua zaman pertahanin parenting sandwich generation
2309;nama sandwich generation kakak nyicil rupiah kakak
2310;lensa hilang cable hilang tambah sandwich generation
2311;mah sandwich generation kena siswa loan lengkap
2312;berat orang lunas siswa debt budaya sandwich generation kuat indonesia
2313;thats before married having kids butuh financial stable mental stable physically stable mending enggak usah anak kasihan entar anak korban ujung sandwich generation
2314;gajih juta bulan tarung tabung biaya hidup sandwich generation nikmat hidup
2315;orangtua bijaksana erti kondisi salah anak asih orangtua kasih jatah sandwich generation nama bentuk balas budi orangtua bentuk cari ridho orangtua
2316;ambil contoh orang tua suka main judi mabora atur uang usia matangideal anak korban anak nanggung hutang sandwich generation sungguh
2317;anak kasih jatah bulan anggap sandwich generation konteks snapgram sederhana
2318;mah sandwich generation cari kerja spek sempurna dewi umr gencet biaya hidup suruh utang kuliah
2319;sandwich generation anak biayain orang tua adik benci dilahirin kondisi pikir shifting hebat anak hasil angkat
2320;kakak preasurenya gen umur cari kerja susah mentok umur gelar kuliah hadap ukt uang semester gila sandwich generation whatt
2322;kakak suruh nanggung sandwich generation dongatau kuliah adeknya kuliah tersier biasa buruk selingkuh kdrt dsb umur jadi patok kedewasaanumur
2323;opemeneh gen rangkap sandwich generation double sandwich sis gen kreatif tahan banting
2324;kesal anjggg rasai duit gin iya sandwich generation arghhhhh nangjs
2325;pacar kagak cakep wow gaji gede mantan jabat sandwich generation laki insecure suka sok cakep denial tolak gadis korban dungu
2326;sumatera jawa geprek generation teman sandwich
2327;perintah paham nambahin beban siswa loan bayang sandwich habis lulus kerja itu susah sandwich nyicil siswa loan sehat sehat sandwich generation moga stabil finansial
2328;orang tua duaduanya sandwich generation anakanaknya seems did sandwich genaration wrwrwrre
2329;kiblat siswa loan ngeluh kena utang perkara siswa loan tingkat homelessness uang hasil kerja pasca kuliah nabung bayar utang kuliah sandwich generation
2330;garagara baca curhatan sandwich generation kayak masuk timbang benar income contingent loan demografi
2331;anjing bayang siswa loan sandwich generation perintah bikin rakyat depresi kocak
2332;wow jahat siswa loan orang sandwich generation siswa loan
2333;iya lahir sandwich generation mana kakak tua urus nafkah ekor adikadiknya sd balita bantu orang tua bayar hutangpiutang tumpuk orang tua kerja
2334;ngerokok mabuk main judi sandwich generation hasil lulus top universitas minus jawir
2335;enggak pernah alhamdulilah orang tua problematik sandwich generation sulit uang bantu orang tua malu
