;Stemming
0;kaluna film rumah sweet loan mah sandwich generation
2;uang minggu tinggal sisa nyicil apk apa iya allah sandwich generation iya
4;harga tiket segitu rencana ajak teman otomatis beli tiket wanjir hidup sandwich generation pening dikit cari sugar daddy
5;moga allah lancar rezeki sandwich generation amin allahumma amin
6;kembang stuck situ dftr kuliah dukung improve bbrapa kali ragu dukung habis habis lang bangga gampang ngmbil kputusan sandwich generation
7;ayo beli es krim sandwich generation bayar
9;sandwich generation gaji juta andai ngeluh
10;posisi sandwich generation orang tua bebanin kakak materi karuan titik iya rumah kuat
11;alas suka hidup sandwich generation hutang orang tua bagi pikir anak investasi pikir goblok
12;percaya sidin sandwich generation jua sadar sadar sidin laku anak mesti kytu jua kdpp teman kadang beda dapat coba lemah lembut enak dengar sesuai
13;kasihan stroberi generation oalah sandwich generation maksud
15;betakun gas buhankm tinggal lawan orang tua sandwich generation kadang juang lawan beda dapat lawan orang tua buhankm tanggap terimakasih
18;this economy sandwich generation nabung ayo coba frugal living ala kaluna rumah sweet loan pepatah nabung bukit kunci postingan
19;makjii youre kind terima kasih makji storage handphone penuh buka documents suka lambat ganti handphone tunjang ajar kuliah sandwich generation bismillah moga rezeki iya allah amin
20;sandwich generation haru tonton video terima kasih kakak gerald video inspirasi
21;iya sandwich generation ovt takut beban
25;sandwich generation taruh keluarga atas bahagia muda
26;bau bau sandwich generation otw cari kerja gaji digit
27;teman anak perempuan keluarga pindah energi maskulin feminin otomatis keluarga sandwich generation peran provider ambil putus bantu lift whole
28;ngomongngomong kaluna rumah sweet loan tau generasi sandwich sandwich generation
30;alam pacar didik ekonomi bawah sandwich generation gaji asli isi kelai toxic habis bikin mental rusak
31;orang lihat hidup enak tidak ada beban sandwich generation pasang badan bantu saudarakluarga galop tulop pinjam online bantu suami dah mending tau
32;iya they are rich beginning old uang istilah keren its such privilege lepas beasiswa sandwich generation waris rintis cant hubung
35;sandwich generation part transfer uang rumah bayar cicil motor isi pulsa rekening sisa rupiah mikir hidup uji matematika
36;sandwich generation part orang tua kerja bantuin hati dompet sanggup bilang iya sesuai otw atm menang
37;sandwich generation part gaji langsung bayar tagih listrik bpjs kasih uang jajan adik mikir makan minggu pakai iya sesuai sadar mi instan ayam bawang teman setia
39;ngasihnya sukarela keluarga sandwich generation tanda terimakasih kasih privilege
41;untung orang orang sandwich generation berat kesal
42;pikir gaji umr jakarta sandwich generation frugal living taruh mental kehehatan badan budak korpo subuh umur pendek sering badan forsir kerja kondisi istirahat regenerasi salut
43;hubung kaluna sandwich generation beda tabung rupiah juta
44;sandwich generation bikin susah ngumpulin uang
46;salah sandwich generation capekk astaga
47;orang pamer rekening sama hidup karakter fiksi nama kaluna film rumah sweet loan komen sandwich generation tabung ratus juta kaluna gaji pegang orang tua
48;kaluna nabung juta gaji segitu sandwich generation
49;susah iya jalin hubung sandwich generation
50;biaya besar anak ah bilang anak rezeki big anggap bikin sandwich generation orang tua biaya orang tua anak nanggung anak sadar kasih ambip
52;sandwich generation gaji enggak bisa pakai langsung ludes keluarga tertawa sehatsehat badan
54;seru iya sandwich generation kakak bayar kakak adik butuh kakak
55;anda kakak anies bikin konten gaya hidup hemat deflasi investasi mjd kuat sandwich generation apa financial kolab
56;pikir pecah karir sukses tupung sandwich generation
57;sandwich generation anak bungsu lucu hha
59;iya allah moga habis temu jodoh sungguh pria mapan royal family man setia syukur kasar suka bohong pihak anak istri mertua ipar sandwich generation amin
60;orang tua saudara benalu laku iya calon suami sandwich generation terima korban materi kasar mentingin keluarga
61;buka usaha ortuku biar sandwich generation kerja habis resign ibu puji tuhan uang kadang ngsh arisan
62;tani kakak beli self reward untuk cerita kerja self reward putus beli im proud of her kakak anak kala ramai sandwich generation kakak
64;anjayy beratresiko sandwich generation semangat
65;rumah sweet loan hubung anak bungsu sandwich generation anak iya cerita anak bungsu omong asa beban orang tua kakak sukses
66;posisi kaluna ajar kosakata bahasa inggris sandwich generation deadwood beban keluarga breadwinner tulang punggung keluarga loan pinjam kinship hubung kerabat caregiver rawat workaholic gila kerja
67;tabung juta iya gaji juta freelance sandwich generation tertawa
68;sandwich generation butuh gaji tbln
69;cipta ruang penuh canda tawa anak muda sandwich generation biar stres duniawi visi
70;tonton rumah sweet loan kabar film sukses tembus juta tonton blistener adaptasi novel almira bastar film cerita sandwich generation
71;film bioskop kakak alur sandwich generation
72;cipta ruang diskusi motivasi pemuda fase sandwich generation yuk ikut
73;sepupu orang tua lengkap tinggal nenek ibu pinjam uang anak yatim sandwich generation alas kerja wkwkwkwk tawa
74;sandwich generation sedih perlahan ubah pikir hidup manfaat keluarga sehat kerja syukur
75;hidup sadar bawa sandwich generation tekan arah kadang pikir tahan tahan
76;rumah sweet loan bagus urai air mata nontonnya film anak bungsu perempuan sandwich generation budak korporat juang hidup mimpi rumah pokok tonton penasaran
77;salah juta tonton rumah sweet loan sandwich generation
78;sandwich generation gamandang gender banyak anak sulung
79;twice kerja ecer ngambil parttime sandwich generation teesbe
80;gaji juta normal gal nabung digit sandwich generation tinggal orang tua kerja gaji juta nabung juta
81;tips tahan sandwich generation hilang
82;anak sandwich generation kayak butuh
84;sek sandwich generation suka sedih orang tau intan mah enak tertawa tertawa ceritain hidup kah tukar
85;guaaaa kesell suka minjem uang alas alahh muda tanggung cuy sandwich generation anjing ngidupin keluarga bantuin single parent adik kelas gaji juta anjing
86;iya kadang rodok anak nek arep rabi maneh sandwich generation untung wing onok konco snapgram iso utang juta
88;hyun oh jujur eun handphone sandwich generation
89;relationship butuh pacar butuh uang cicil hasil sandwich generation still budak korporat dream goal beli villa bal aset mana marcedes benz
90;ketemu kaluna layar lebar asa hubung hidup sahabat hidup sandwich generation mudah tuntut kuat tanggungjawab penuh
92;malas main pabji kena sandwich mentangmentang sandwich generation
93;kayak sandwich generation orang tua uang pensiun rantau suruh bayar listrik lingkar orang
95;selamat pagi kejar batas waktu sandwich generation semangat kerja kuliah semangat semangat lupa makan jaga sehat minum air putih terus hidup
96;mending mati anak sandwich generation
97;rumah sweet loan hubung sandwich generation tidak tahu sandwich generation mah siappp
98;rumah sweet loan bagus film hubung kaum sandwich generation kaca nontonnya
99;kasihan hyun oh sandwich generation
100;hidup lambat living lupa anak sandwich generation huft
101;lahir didik dar konotasi sandwich generation tempel pada negatif beban anak apa laku wajib anak
102;anakanak andelan orangtua sandwich generation minghao kriteria manusia sabar unlimited
103;anak gadis sandwich generation ngekos sehat dah
104;tukang benar rumah hari tukang salur air tukang benerin elektronik tukang pijat rumah asisten rumah tangga hari sandwich generation sadar meni
105;lahir anak sesuai nikah sandwich generation iya hidup maaf hamba syukur
106;repliesnya sedih fenomena sandwich generation tambah ekonomi hancur ancuran berat
107;omong poster cari google hd anjing anyway orang bilang film hubung sandwich generation juang iya lakon utama nasib saudara bodoh
108;nikah kontak nomer nabung rumah sandwich generation angkat tangan
109;heran orang ngeluh sandwich generation sumpah syukur orang tua hidup anak ngehasilin uang
110;karakter kaluna contoh representasi nyata sosok sandwich generation saksi film rumah sweet loan bioskop sila tonton film moga teman kondisi kuat hadap situasi
111;beliau simpul sandwich generation generasi orang dewasa tanggung hidup generasi orang tua anak
112;istilah sandwich generation ramai bicara sama tayang film rumah sweet loan cerita anak tanggung beban keluarga besar tau istilah
114;anak bungsu juang sandwich generation haru nontonnya
115;sandwich generation lapang kerja sulit biaya hidup
116;bagus konflik angkat sederhana most likely menang hubung per utama sandwich generation dysfunctional family masuk umurumur quarterlife crisis pribadi menang kali
117;sandwich generation istilah sandwich generation ramai bicara tau istilah iya bahas bentar video
118;lihat berita orang selingkuh nikah pasang homo nikah tikung sodara nikah tikung korban kdrt lapang kerja sulit rumah sulit hasil sesuai pas sandwich generation gila syukur
119;biaya hidup mahal gaji layak sulit didik indonesia jelek mahal sandwich generation cita nikmat tua orngtua mewah
120;speechless lihat sandwich generation dimintain uang juta bulan gboleh syukur orang kerja keras anak pales alias beban kluarganya bodoh wkwkk moga produktif dek
121;hai hai geopeeps admin tebak sandwich generation iya tau sandwich generation
122;teman cerita gaji nabung juta sandwich generation iya asal paham jelasin bilang
123;susah umi sandwich generation susah fokus
124;beda novel cerita tambah film sedih kakak hubung sandwich generation baik
125;hmmm savingnya sesuai site iya sandwich generation kali iya
127;wowkwowkwokwwowkkwwkwk dual income sandwich generation ceunah
128;sandwich generation tau cerita siapa biasa dengar dengar sedikit ingin
130;sehat sehat grup kambing hitamtulang punggungsandwich generation agens
131;tuju nikah nikah orang tua paksa nikah mental finansial bikin anak sengsara bikin anak sandwich generation
132;faktor belakang berkarir musti pikir meni sandwich generation boroboro nikah urus keluarga
133;gaji langsung butuh rumah film rumah sweet loan persis sandwich generation tertawa sedih
134;kadang ngeluh sandwich generation anyinggggg kesal salah
135;kesal sandwich generation gaji sesuai pas atur uang orang tua bayar malam suka menang pikir depan lagia
136;sandwich generation susah cari kerja indonesia kerja gaji paspasan trauma nikah orang tua butuh nikmat hasil kerja feminisme depan gay dimanamana biaya hidup dsb
137;rokomen suhu film rumah sweet loan related anak sandwich generation
138;injak dewasa kaluna surup arwah sandwich generation buat tulang punggung keluarga gentayang sosok beban keluarga keri kaluna hasil selamat teror
139;sandwich generation pahlawan ekonomi keluarga
140;pengaruh media sosial sandwich generation pengaruh lingkung sosial sisi gelap nikah kualitas lakilaki indonesia turun erti pilih meni
141;kadang lihat suami pusing urus kerja enggak bisa beli ken sandwich generation kerja rumah ganti weyy rasai kesal tertawa
142;modal urung eneg sandwich generation meh sok nek wes mbojo soale lumayan iso njileh modal karo bojone tertawa
143;bungsu sandwich generation gitu nabung tahun beli rumah
144;tau bingung pilih capai sadar sandwich generation cewenya harap
145;rumah sweet loan cerita tapak bumi milik rumah tabung sandwich generation isu relevan cerita dialog lugas alir detail kaluna realistis ulas
147;adikkakak nelpon anu ajar sepatu tas anu piknik bayar lambat tanggal sekian uang bulan habis semangat sandwich generation
148;baca review film rumah sweet loan kisah sandwich generation impi rumah tonton film baca reviewnya
149;few decide kids sandwich generation tipe mandiri dewasa anak anak anak anak nyala oh anak
151;sandwich generation tonton konser tuju biar hepi sesuai akhir pekan weekday menang tau setlist konser breathe
156;terimakasih thread must baca sandwich generation there
157;hitung kumpul segitu sandwich generation nabung jadi but alhamdulilah uang sehat iya
158;kaluna tabung juta stan kpop sandwich generation
160;sebut anak sandwich generation sponsor benefit gangguatur hidup whatsapp
161;euy gapapa umur tabung sandwich generation sakapeung sok sedih ai kadi
162;kynya calon sandwich generation tamat kuliah
163;enak sandwich generation enggak mau salah bilang enak enak segak enak asli hidup berat bilang hidup
164;tabung tertawa iya gaji diitung tabung alhamdulilah sandwich generation rantau syukur gaji digit habis renov rumah dsb tabung gaji orang rumah butuh
165;dar saran sandwich generation iri sedih tabung orang harusny bangga uang abadi ladang pahala uang memanfaatkanny ahli waris nama umur enggak tau
167;pacar ngide tonton rumah sweet loan tau iya film sedih bikin nang banjir malu buset film cocok tonton kalang sandwich generation mah menang menang tuh
168;kaluna keren iya nabung juta dikit dikit jajan kumpul kayak kali iya tabung segitu jir film rumah sweet loan bagus sandwich generation kayak hubung percaya
170;apresiasi film rumah sweet loan hubung sedih cuy kaluna keluarga apa ratingnya sandwich generation mah tonton
171;kaluna baik ever sosok inspiratif sangka isu sandwich generation angkat film rumah sweet loan
172;hubung habis kaluna rumah sweet loan sesuai sandwich generation apit tanggung mimpi
173;konser admin tabung oh iya this sandwich generation
174;tonton rumah sweet loan tau nanggung beban finansial keluarga sandwich generation
175;gaji kaluna tabung gakbisa kaluna kaluna mikir biaya nikah sponsor orangtua sandwich generation
176;tonton rumah sweet loan benerbener kaca hidup seharihari kisah kaluna wakil masyarakat kelas tengah sandwich generation lupa perintah bantu
177;bangga pilih kaum sandwich generation
178;anak sandwich generation rantau kerja urus tolong
179;kakak luna nabung tabung sandwich generation
180;ekspresi anggota paguyuban sandwich generation be
181;umur patut syukur sandwich generation syukur alhamdulilah
183;sadar lakilaki meni kelas tengah sandwich generation jepit pajak hasil rendah bantu uang keluarga tabung serah bantu wedding dream pasang
184;alas teman teman sandwich generation bokapnya kebel rumah waris orang tua
185;kayak enggak mau kakak api takut sandwich generation
186;wajib nonton kisah anak perempuan sandwich generation kakak
187;hemat sandwich generation susah hemat gizi penuh iya sakit rugi
188;anjir susah sandwich generation beli jatah makan bulan
189;tuhan saldo daya lahir sandwich generation bikin habis gaji tau lari mana uang nabung sulit jiwa hedon suka koar
190;anak an sandwich generation kerja lanjut besok enggak punya tabung harta limpah bangga mata orang tua
191;istri riwayat sakit sandwich generation lengkap
192;kritik bilang tambah seret rezeki iya perkara katakata sesuai mas kakak kalimat cocok pakai untung sandwich generation
193;swami be sandwich generation pahalee okeehh
194;sandwich generation suruh cintacintaan tertawa asa salah asa orang chill
195;anjing gaterima iya rakyat laku ikhlas rido gaji sandwich generation potong
196;sandwich generation berat pasang orang sandwich berat
197;anak perempuan sandwich generation bayarin tagih keluarga pasang mentok sandar tembok kamar
198;moga allah mudah lancar limpah rezeki sehat jasmani rohani amin kuatkuat teman sandwich generation sending virtual hugs
199;rekomend banget kak related sandwich generation wkwowkwo
200;menang lihat cerita anak sandwich generation
201;faktor contoh finansial sandwich generation mental
203;sandwich generation gmpng tipu lihat alhamdulilah tabung enggak hutang sehat jasmani rohani allah akbar
204;iya percaya sandwich generation keren teman tahan saat orang sulit tahan cowok barang buka tiktok sandwich gen semangat moga lelah lil moga senang keluarga
206;sandwich generation mohon sabar tertawa
208;kerja lembur quda sandwich generation
209;beda kondisi disamain sandwich generation anak sandwich uang beli duit habis bagi
210;memang enggak bisa iya lihat orang selfappreciation adu nasib jamin sender sandwich generation hobi pesta pooper
211;anak sandwich generation minus teman
212;sandwich generation hobi konser penuh senyum balik
213;sandwich generation token habis teriak kang sayur iya inti nutup mata telinga orang butuh percaya tuhan kasih berkat
214;yoongi ide topik lagu baru sesuai kondisi orang umur disuru nikah tinggal nikah mantan selamat damai mimpin capai iya sandwich generation
218;sandwich generation gaji undur juta senyum
219;juta bulan kakak gantung hasil usaha juta gaji juta suami juta sandwich generation hutang cicil oh iya gaji turun honorer
221;suka iri sandwich generation ikhlas pahala keren kakak bayar kuliah alhamdulilah moga lancar kak
223;ken beli teman apa sandwich lap generation
224;sosok kaluna film rumah sweet loan bikin sandwich generation hubung film nyeritain juang anak bungsu tulang punggung keluarga
225;kabar gaji upah minimum anak sandwich generation iya moga beli buku diskon iya xixixi
226;komen catat sandwich generation askes tanggung kantor anak pasang suka foya financial freedom paruh baya
228;nerapin gaya hidup kaluna gaji bawah umr sandwich generation bayar hutang keluarga hidup hari tau miskin self reward tambah acne fighter dasar
230;alhamdulilah moga sender sandwich generation tuntut uang gaji lengah dikit wristband moga saei passive income segitu amin
231;sandwich generation lihat orang ngumpulin uang gin
232;akal akal malak uang rakyat umr rendah umr iya allah moga bijak engkau gagal gimanapun kuasa sumpah anjiiiiing sandwich generation pangkas megap hidup
233;sandwich generation beli rumah renovasi rumah beli kendara beli kayak sandwich generation
234;kakak sandwich generation tabung gin maaf him
235;kayak tabung sandwich generation kenal gim judi
236;nyicil nabung alias sandwich generation
237;tabung mas ngebiayain rumah alias sandwich generation
238;turut cocok posisi sandwich generation kakak kaluna nikah gaji pakai iya apes kaluna kalah kakak lebig bain ibu part sebal
239;sandwich generation kadang suka suudzon tenang tau jadi bikin uang
242;gantung keluar om sandwich generation berlapislapis tekor duluan boroboro nyicil apart
243;sandwich generation kumpul gin sayang duit bayar kuliah hidup seharihari bayarin utang keluarga ngehidupin keluarga
244;marah sedih ngerugiin masyarakat tengah bayang karyawan kelas tengah sandwich generation
245;enteng omong mah enak pikir nikah tidak ada cicil tidak ada utang heeh temenmu gaji bulan sandwich generation nikmat gaji segitu enggak bisa woii berisik
246;aamiinn ayo tour indonesia sandwich generation pergi konser someday
247;sandwich generation fenomena sosial perhati
248;cinta lap ala sandwich generation
249;semangat sandwich generation moga berkah beb
250;sandwich generation tabung ribu syukur
252;moga untung sowoozoo beli uang beli butuh rumah hati beli wl apa daya sandwich generation
254;tabung privilege sandwich generation banyak nama hidup jalan
255;sandwich generation nyesekin dada tau zaman bacot tetangga perhati egois hidup keluarga orang orang lihat tekan sandwich generation
256;kaluna sandwich generation bayar token rumah biayain orang tua film iya wajar tabung juta
257;kasih tau kunci sandwich generation
258;hidup kaluna sandwich generation seringkali kadang kasih its huge privilege sedih keluh sedih ngeluh asa valid
260;lahir keluarga sederhana privilige sandwich generation
261;sandwich generation kah umur enggak punya tabung
262;tau sandwich generation berat sangka berat lancarlancar rezeki moga beli rumah tulang punggung keluarga
264;iya cerita sandwich generation gitu
265;usia tabung juta freelance sandwich generation usia rumah negara beda
266;mimpi butuh biaya kaluna beli rumah halang tanggung keluarga cerita hubung sandwich generation salah satu coba baca tips atur uang jenius
267;sbnrnya anak relatenya sandwich generation tertawa
268;mnurut kakak ale hubung anak bungsu sandwich generation
269;umur enggak punya tabung sisa gaji anak perempuan sandwich generation alhamdulilah
270;kakak bayang gaji juta hidup sandwich generation tabung
271;injak dewasa kaluna surup arwah sandwich generation buat tulang punggung keluarga kaluna hasil selamat teror rumah sweet loan tayang bioskop
276;sandwich generation kakak orang tua pensiun hidup uang
278;nabung juta an bulan sender sandwich generation
280;imho kaluna nabung segitu sandwich generation iya beli token listrik nanggung biaya makan keluarga anggota keluarga sakit beli diapers obat bpjs
282;mudah rezeki anak sandwich generation iya allah
283;ekspektasi sehat tukang jajan sandwich generation gaji umr
285;rebut sandwich generation nabungnya langit bre
286;sandwich generation bikin generasi susah nabung salah satu iya nanggung beban keluarga
287;pengin caci maki iya adu sandwich generation
288;nabung kakak bulan makan bekel rumah rumah daerah jakarta busway pp hari tinggal rumah orang tua buka sandwich generation biayain orang tua
290;mesti tabung tembus an konversi butuh sekolah adik perlu keluarga hari kah sandwich generation kayak mah main kursus
293;base post usia tabung semangat sandwich generation semangat
294;roti jarang jajan sandwich generation
296;nasib sandwich generation itusih jri nama
297;kerja enggak punya tabung sandwich generation
298;kakak tidak tahu benar cari atensi pure tenang luar sandwich generation mati nabung enggak bisa isi rekening
299;iya bagus segitu gambar iya enggak bisa gambar bedabeda sandwich generation
300;im millennial married sandwich generation duit habis perlu hari sekolah anak asih orang tua suami kerja omong
301;benerrrr konteks nikah iya dikit acara single umur hidup sandwich generation tabung segitu umur gin oke oke
302;mending der uang gopek bingung bayar butuh hug sandwich generation
303;juta possible gaji juta sandwich generation nerapin frugal living
304;sedih sandwich generation sedih sandwich generation enggak bisa kasih penuh keluarga
305;oya sandwich generation privilege manfaat bawah biar anak bayarin hidup hidup frugal mentok bayang baju puluh pakai dibenerin
306;sandwich generation huhu mamala tolong manfaatin sebaikbaiknya pinang princess gendis tertawa
307;kemarin offering juta lepas sandwich generation juta sana tahan
308;masuk akal novel iya sandwich generation tinggal orang tua keluar makan tanggung orang tua keluar layan mobil jajan novel kerja omong masuk akal
309;kadang biar jalan guna istilah sandwich generation
310;sandwich generation anak sulung bilang lucky tabung prioritas anak orangtua
311;orang mimpi tau sandwich generation wajib tonton hubung tata hidup diribetin keluarga
312;yaampun apkh tanda sandwich generation konten konten
313;anak tumpu sandwich generation berat moga
314;bagus daily hidup nyata cerita sandwich generation sodara toxic bangkein pilih castnya sesuai derbi romero sweet lihat lanjut kisah danankaluna
315;saldo segitu teman kesal sandwich generation tertawa
316;iya jir masuk akal sandwich generation
317;semangat tau kuat ayo lewatin bareng bareng doa gais calon sandwich generation adik sekolah doa kuliah lancar karirku biar nasib adik ubah makasiii
318;sandwich generation nyukup gaji syukur
319;gagal hasil enggak bisa nilai uang tabung turut asser tabung ayg sandwich generation hidup gantung orang menuruku berhasillll
320;syukur enggak sih teman umur segitu sandwich generation nabung kesal apaapa nanyeaakkk
321;percaya teori matematika tuhan teman tabung this sandwich generation
322;otw tidak ada tabung tertawa sandwich generation
323;anak bungsu sandwich generation tulang punggung keluarga suka kalah apa
324;hubung anak bungsu sandwich generation
325;hahahahhh pesimis gaya hidup tahan hawa nafsu beli gaji bawah juta kumpul sentuh juta faktor salah satu sandwich generation
326;canda benar hubung duit habis kejap bayar butuh keluarga sehat sehat sandwich generation
327;teman enggak bisa nabung sandwich generation uang segitu lumayaaan saran paro investasiin reksadana low risk tokped cair instan biar uang ngendap
328;sandwich generation hubung maaf kaget
329;kaluna frugal living jir miskin sandwich generation kakak living expensenya dibiayain bapak dasar novel tidak ada cerita dibiayain lip models side kerja an omong
330;anak bungsu sulit jujur bayang kaluna bungsusandwich generation
332;nabung juta sandwich generation keluar nabung bersih gajih kayak berat butuh primer ikut gajih gajih juta juta butuh primer penuh
334;inti sandwich generation biayain bantu adik kakak
335;syukur orang sandwich generation nabung senang
338;sandwich generation sisi sadar betapa beban keluarga repot sadar anggota sumber kasih sayang kondisi bikin tekan gambar keluarga hsl
339;kaluna sandwich generation beda berani rumah sabar habis
341;siapsiapp sandwich generation cerita anak laku kasar bapak aduh another another reason mikirmikir nikah
342;iya syukur teman sandwich generation tabung usaha nabung sesuai sesuai an ajar syukur iya
343;juta asumsi tahun nabung juta bagi juta bulan which gaji tinggal jakarta sandwich generation mati
344;sandwich generation cant hubung bisa kaluna nabung nyeblak kali iya
345;wahahaha tuju sandwich generation bundd
346;sandwich generation hubung kaluna tabung juta hikssss
349;semangat sandwich generation gaji langsung habis bayar butuh orang rumah
350;follow instagram alas penasaran film plot ringan reaction menang soundtracknya bikin merinding cerita mana related sandwich generation harap untung moga pilih lihat kaluna
351;turut kaluna sandwich generation tinggal orang tua keluar kaluna irit pasti bonus minimal gaji kaluna irit jujur
352;iri kaluna samasama sandwich generation beda urus pernabungan lunnnn
353;tabung doang hubung kaluna sandwich generation anak rantau tukang self reward bakso seblak nyala diri
354;kadang ngeluh malu allah iya allah yatim alhamdulillanya sandwich generation uang biaya adik erti penting
355;sandwich generation moga tabah ikhlas hati
356;salah patut syukur sandwich generation
359;maaf benar sandwich generation berat
