;Stemming
1030;gaji juta kelah sandwich generation
1032;usia jarang sepi tengah ramai gen sepuh keluarga tuntut sandwich generation nikah jawab mohon doa
1033;siang debat teman kantor enteng bilang orang sandwich generation salah enggak bisa manajemen uang
1034;sandwich generation vs nabung nikah yallahhh
1035;tampar realita sandwich generation bolak psikiater pikir carane biar waras keluarga senang lihat kon well hibur sesuai kesal semangat
1036;menang ratus ribu eh siang orang tua minjem uang juta bilang sandwich generation tanggal kasih jatah bulan tidak apa ikhlas
1037;kakak kuliah hasil beasiswa reguler iya enggak bisa kerja kah maksud daring iya sedih sandwich generation
1039;istilah sandwich generation muncul stawberry generation besok besok alpuket
1040;sungguh allah anak anak sandwich generation menang dikit
1041;sayang anak perempuan sandwich generation kuatkuat iya
1042;salah alas sandwich generation indonesia bijak perintah
1043;tutorial damai sandwich generation damai kalah keluarga
1044;kuat kuat anak bungsu sandwich generation tulang punggung
1046;soresore enak makan sandwich generation
1047;kerja diri kadang jam minggutgl merah masuk tidak ada libur bilang stres iya stres sandwich generation
1048;wakil bingung bikin rumah iya sandwich generation hasil pas syulit beli bahan bangun rasa berat
1049;pribadi rekomen kakak cerita hubung masyarakat tengah sandwich generation romancenya sesuai baca novel selagi tunggu film tayang
1050;iya allah sandwich generation tolong
1051;kesal hidup sandwich generation akar
1052;pakai koyo kasihan mi sandwich generation
1053;dasar alam pribadi gaji umr newly wed ngontrak sandwich generation cicil beli barang mewah negeri itu sesuai pas butuh hari nabung jalan jalan akhir pekan
1054;kerja kaki kepala kepala kaki beginih kerja ripuh sayang sandwich generation hidup manusia bulannyah
1055;salah alas sandwich generation bijak perintah
1056;wanti orang rumah peka pagi lampu matiin kipasac appn pakai langsung matiin temperatur mode ac perhati iya kaum middle kelas sandwich generation
1057;mikir sandwich generation beban berat semanget malesan gaya hidup teruus kejar debst
1059;sandwich generation kerja gaji utuh keluarga cemara jajan mana tros sahabat kualitas masyaallah tebak ujiaan dimna
1060;salah alas lahir sandwich generation bijak perintah
1061;sadar iya perintah peran bikin sandwich generation
1063;adil middle kelas sandwich generation
1064;ide tanggal tua pakai arisan enak gaji juang tunggu gaji sehat sehat sandwich generation
1065;susah babe sandwich generation mah
1066;mein kempf sandwich generation edition sadar asli bayarin utang bayarin simpenannya tabung juta ludes minggu bayarin adik kuliah selesai juta purwadhika
1067;depresi sakit cari kerja lulus susah coba cpns terima admin toko adik gaji kerja halang batas usia sandwich generation orang tua kerja adik nikah bayar
1068;salah ras kuat bumi iyain anak perempuan sandwich generation mutus rantai adik sekolah kuliah anak
1069;ngersasa sandwich generation beban ulang ulang
1071;untung cukup sesuai kerja suruh asih jatah orang tua bilang sandwich generation
1072;bingung balas sandwich generation berat jalan bahagia semangat puas nikmat hasil kerja bayarin bahagia
1074;iya orang gaji digit pjawa pinjam uang orang pulau gaji umrsandwich generation posisi ekonomi keluarga
1076;sandwich generation era tahu literasi uang orang tua beda kerjabisnis uang erti kelola erti kelola sisa tertawa
1077;sibuk kuliah kerja tahan hidup sandwich generation
1078;mau langsung belanja sesuai tanggung sandwich generation hubung ayo coba absen kolom komentar
1079;pilih wartawan ajar buruh kelas sosial andai realita buruh ajar tuntut hidup sandwich generation miskin struktural
1080;beli properti nyicil rumah nyicil motor mobil hitung pajak orang sandwich generation asih orang tua nyekolahin saudara pikir jajan roti ribu
1082;pajak potong pajak tahun gangotak klasifikasi perintah maruk rakyat sandwich geprek generation bengek
1083;kelas tengah rugi buruh budak korporat tanggung beban hidup bantu perintah sandwich generation
1084;butuh uang tahan hidup nafkah keluarga sandwich generation tahan kerja tempat
1085;kecewa keluarga middle kelas kakak sandwich generation pilih diam sembunyi suara sosial media
1086;grup chat sekali aktif langsung ratus maklum isi sandwich generation
1087;ih anjing keluarga geblek mending usaha kayu anjing bikin juta juta orang melarat mah sandwich generation tinggal diam tunggu putus kerja enteng keluarga ubah ubah
1088;cerita sandwich generation biayain keluarga beli rumah hubung iya anak muda zaman
1089;kakak erina tau sandwich generation tau iya adekku gopoh bayarin kuliah adik tua darah gopoh cari uang anak sekolah biar didik kakak
1090;tau sandwich generation hahahahahhaaghahahahahahahahaha term
1091;tertawa mah enak pikir negara duit ngefek coba orang strugle cari kerja sandwich generation tinggal indonesia respon beliau tertawa
1092;mahasiswa cuek politik kali enggak bisa cuek anak sandwich generation enggak mau peras mati keluarga owi darah keringat usaha beli roti nepobaby
1093;sandwich generation bikin susah gara gara bijak anjing kecewa keluarga owi keluarga cendana minder bejat
1094;temantemanku paksa sandwich generation hilang tulang punggung keluarga kondisi uang baikbaik canda jabat tolak maaf
1095;sandwich generation laku anakanakku kelak ajar juang
1096;sandwich generation coba tangan sandwich generation terhimpit roti lapis atur uang pikir tanggal tua
1097;sehat tulang punggung keluarga sandwich generation sehat penuh hidup keluarga keringat terimakasih teman berani turun jalan wakil
1099;hancurrrrr sandwich generation rasa berat penuh biaya hidup hari
1100;lulus cari info loker sandwich generation anjing cari kerja susah tidak ada ordal kerja magang susahh tidak ada bantu ordal babi
1101;ngantor pakai baju hitam jujur terjun sandwich generation
1102;makan pajak rakyat pajak tukang bakso pajak jahit rumah pajak sandwich generation pajak rakyat miskin minimal malu
1103;fitur seabank sandwich generation transfer enggak mau uang biaya admin minsea spill fitur transfer grup transfer keluarga lupa balas transfer grup sebanyakbanyaknya
1104;indikasi jadi sandwich generation mbah kandung coba kuliah anak financial plannernya dimatengin nyatot anak orang hutang budi
1105;makasihh dik sri mbah men jadi sandwich generation nikmat hasil jerih payah disuoport sayang
1106;bau masyarakat middleclass tunggang tungging kerja lembur sandwich generation
1107;curah hati sandwich generation konser keluar butuh rumah keluarga
1108;susah iya sandwich generation foya foya dikit bilang egois rumah
1109;suara rasai dampak susah cari kerja apaapa serba mahal sandwich generation adik putus sekolah enggak bisa bantu apaapa nyeseknya ampun
1110;tipe taco sandwich generation mandiri gueh
1112;mahasiswa sadar cari kerja susah lapang kerja minim meanwhile sandwich generation nekat kejar tentara keluarga bingung besok makan hidup
1113;kadang kesal sandwich generation tanggal muda tanggal tua rasai gaji gaji bayar spp adik bayar tagih motor bayar tagih sisa iya
1114;sandwich generation kelas tengah lihat beda ekspresi orang tua lonjak harga sektor serba mahal kelas tengah mandiri tekan terus spya enggak bisa gerak
1115;mjb beneer rasa kakak ekonomi keluarga maju uang gampang sulot omong sandwich generation halang lapang kerja susah
1116;konflik sandwich generation alami kaluna film rumah sweet loan benarbenar sentuh hati yunita siregar
1117;imagine sakit pcos kista anak cewek sandwich generation negara thats anjing emosi kesal bodoh
1118;sandwich generation kakak kaum tengah atas susah raya naudzubillahnya gampang nyungsep
1120;mah ikhlas sandwich generation alias ganti tulang punggung keluarga sesuai lulus kuliah perintah dongo sebanyakbanyaknya sandwich gen banyak calon sandwich generation
1121;kerja alhamdulilah suami larang kerja tau istri sandwich generation hhahaha
1122;kasihan suami anak suami pusing cari hasil tambah sandwich generation mesti mikir mana lahir normal caesar biaya
1123;ajar janji jadi anak sandwich generation kesal capekk nanggung beban tau sambat melulu
1126;its happen before gabung hidup sungguh jobseeker sandwich generation persetan
1127;bagus pikir buka melulu nikah anak pikirin depan minus mikir kalang didik kalang didik banyak sandwich generation
1128;fokus anak muda fokus keluarga sandwich generation trauma keluarga lang nikah butuh siap mateng
1130;cinta cinta opsional kakak keras hidup mikir cinta cita alih alih cari uang sandwich generation
1131;zaman melek perkara patriark miskin dsb sandwich generation jgnkan urus anak orang keluarga urus iya gaheran pilih hidup nikah
1132;alas utama ekonomi alas prilaku kdrt alas tiga bayak selingkuh alas merdeka sandwich generation alas ribet urus anak orang
1133;tulang rusuk tulang punggung sandwich generation bocil iya allah info loker
1134;iya euy tertawa udahmah teh sandwich generation tulang punggung keluarga pusing dikomen aiueo uang uang hasil banting tulang pasang mending cari calon financially gratis
1135;sandwich generation mana keluarga naung jaya masa sia usaha gapai sulit beban pundak
1136;cerita observe teman tongkrong typical ice breaker parah dua dark dihadapin tinggal simpan strong sandwich generation
1138;ahmma film millions before grandma dies diingetinget sandwich generation pantesan film senyesek
1139;sandwich generation meleng dikit saldo jerit tertawa kocak
1140;sandwich generation tipe ecek gratis biologi link instagram pinhome balas kepala thread hasil biar dukung
1141;sandwich generation adik cowok gelut mimpi beliau angin bak limpah anakanaknya harap angin anak alat
1142;omong sandwich generation tipe gila kerja ngumpulin uang bantu keluarga nyisihin bodoh avoidant tanggung tipe
1143;nabung beli rumah hasil paspasan tambah posisi karakter utama sandwich generation bikin sulit wujud hubung iya film rumah sweet loan visinema tungguin september
1144;iri orang nikah duluan iri anak olimpiade iri lulus beasiswa iri sandwich generation mental sehat nanggung beban tulang punggung keluarga
1145;tonton menang iya kesal taugasi generasi rintis waris anak sandwich generation asa dewasa uang habis bayar utang keluarga bayar sekolah adik nebus obat sakit
1146;manusia robot kesal sedih marah diperhatiin ganti peran keluarga omong suara getar overwhelmed tumpu uneg sandwich generation
1147;sandwich generation pacar tiga sandwich iyya
1148;iya ampun bikin gembel bjiiiir sandwich generation lusuh orang ekonomi paspasan bikin presentable iya hubung
1149;cewek cowok rezeki sandwich generation cowok sekitarbya
1150;romance house tarik father daughter issue sosok rumah anak sulung sandwich generation hubung kakak naeun far minhonya man tunggu storynya maz
1151;eh serius engah sandwich generation kategori penasaran masuk tipe ayo coba cek tau
1152;segar lulus anggur sandwich generation kagak suruh kerja cepat cepat
1153;junior senior enak sandwich generation huff
1154;orang sandwich generation lapis keju mah paham tertawa
1155;lagilagi urus uang cari pacar kenderaan nama sandwich generation karyawan cicil atas gaji uang iya uang uang iya uang hedon iya pakai uang
1156;romance fhe house hubung anak perempuan sandwich generation
1157;adaptasi novel baik seller karya sembah film rumah sweet loan karya sutradara cerita kisah kaluna sandwich generation tantang raih mimpi wujud rumah sweet loan
1158;anak durhaka drama sandwich generation produktif cari uang gaji boros obat dokter jiwa biar waras dislike ide of marriage efek manusia nirempati syukur
1159;hsl bahas sandwich generation keluarga toxic susah cari rumah jakarta porsi drama kuat komedi pokok khas novel almira ajak ngetawain hidup romancenya manis kaluna dan couple favorit universenya almira
1160;sandwich generation ngene nek rande panggon cerito rodok abot batine jane yoben
1162;aplgi anak cucu harap sandwich generation nyala otak
1164;heran kadang manusia gampang nikah mesum anak konsultasi sh finansial advisor niat jadi anak sandwich generation niat jadi anak investasi tahi anjing bangsat monyet kampret babi
1165;rezeki kakak dukung bantu butuh kasihan sandwich generation moga rezeki lancar iya rezeki adik rewel syukur milik
1166;lestari sandwich generation iya dik iya budaya lestari
1167;ikan bosan hidup sandwich generation
1169;sandwich generation debut saat agens jatuh eh timpa pandemi
1170;oh iya pegawai negeri sipil daerah ekonomi bagus banyak keluarga sandwich generation nykupi butuh keluarga
1171;gacor anak dem sandwich generation mau gen alpha
1174;bellum sandwich generation tahap ajar motor kost kantor biar jlan kaki doanng ngongkos biaya ongkos buatt ngekost
1176;apa daya sandwich generation hobi ngopi saban kepala rumah tangga rumah tangga anak rumah tangga iya alias pokok pondasi keluarga
1178;sandwich generation allah banget gaji punya rumah nikah tabung dana darurat kerja ambang ambang hmm cemas pikir kalut mana allah
1179;target nikah umur sandwich generation rencana capai nikah wml lamar
1180;benar uang potensi sandwich generation masuk teknik akuntansi hukum ekonomi jalan butuh uang posisi bemper uang keluarga omong this sedih
1181;kemarin baca tulis anak sandwich generation perhati orang tua investasi didik anak amal jariyah panjang gimanan anak tabung tua agr repot anak
1182;thats generasi melek literasi uang financial planning putus sandwich generation ubah pikir
1185;sandwich generation enggak pernah asih uang kasih nafkah pelit hitung hasil kuliah keringat ibu kerja nikah kesal nafkah
1186;sandwich generation tanggung adik uktnya ngotak iya dik iya
1187;baca kisah teman teman sandwich generation syukur golong orang tua pisah tau kerja cari uang
1188;hubung sehat sehat iya shauqi moga mudah urus mana hidup arah moga sesal dalam semangat peluk sandwich gnration
1189;gambar orang potensi beban sandwich generation lesat
1190;obrol grup gen sandwich generation kondisi sandwich generation alami hasil grup teh tinggal laughed dark jokes salah sehat wajar
1191;bilang gadis sandwich generation enak banding cowok sandwich generation heh ulek cabe sandwich gen enak opini sakit gadis sandwichgen mah enak enak palalu kotak
1192;gin nasib sandwich generation iya pikir
1193;banjarmasin nabung juta teman sandwich generation
1194;kelas susah jebak miskin struktural gampang kurang potensi tanggung hindar jebak lingkar setan sandwich generation
1195;sandwich generation ekspektasi prtu tinggi cokkkk sial usaha daki gunung lewat lembah
1197;istilah sandwich generation ngarti kakak umur kawin
1198;harap sandwich generation sabar ngelus dada
1199;selfiee twitter kabar sandwich generation hobi save meme hibur sengsara nasib
1200;pusing sandwich generation serba salahh iya ngejelasinnya kayak kesal duluann diceritain
1201;akwowkwk sandwich generation bos uang jajan perlu sekolah penuh okay adik senang ikut ajar usaha adik senang pokok
1202;sandwich generation orang pleaser enggak bisa atur uang buang jauhjauh hubung serius nikmat
1203;tipe sandwich setia perhati multitasker sesuai iya sandwich generation coba kuis coba biar tau tipe sandwich gaesssss
1204;kesal hidup miskin kerja jam sandwich generation
1205;sandwich generation beban regardless gender paksa adil anak anak nopang keluarga gaji umr realistis butuh iya nama wajib penuh keluarga nafkah turun
1206;sandwich generation mikirnya lunasin bayar kirim
1207;tulang punggung sandwich generation nikah nikah allah
1208;harga oleh kampanye reach sandwich generation campaign harga semangat dukung sandwich gen biar generation ayo samasama hebat
1209;enggak bisa jujur tidak ada hasil adik sandwich generation pegang asih pakai uang suami
1210;gapapa raya bagging brands merch muka sold angka jual royalti ostampfeaturing magz muka cover baik seller sandwich generation yasudah ganti handphone
1211;pikir buntel bulu rumah tanggung mobil tanggung sandwich generation sopan omong sandwich generation
1212;kesal kerjaa didzolimo lamar ah cries sandwich generation
1213;yura sandwich genertion kasihan anak
1214;ancam dc pinjam suami pakai nama sandwich generation bantu ekonomi orang tua bantu bayar hutang suami penuh butuh hidup rumah tangga
1216;gadis tabung tiket konser merchandise band ken sandwich generation tidak tahu nikah iya
1217;gila bahaya tugas haris harisjevan rumah biar cari nafkah rela sandwich generation orang tua langgeng
1218;adik kesi ceng sandwich generation kiri kanan uang haaaa tau gakmau mati lamalama insyaallah allah limpah berkah allah bantu apa
1220;sandwich generation lulus kuliah tau mana
1221;butuh uang sandwich generation satu harap keluarga
1223;ripuh gitu rich problems untreatable heartaches maksa hehee teman allah kasih percaya sandwich generation ajar ikhlas terima takdir kadang umpat ah deui deui kehed teh
1224;alamin wkwkwkw peduli karir orang wkwkwkw coba hancur orang sandwich generation peduli kasihan cuy tertawa orang sadis wkwkwkw
1226;stres dua pacar nabung sandwich generation huhu
1227;temu orang api honestly ive never think marriage since im sandwich generation tertawa just fokus nyala earn uang
1228;sandwich generation iya aman malu sandwich generation cari psngan terima orang psngan sandwich generation
1229;sandwich generation gaji kmungkinan bagi keluarga tuju
1230;sandwich generation anak kos saving juta ngekos iya kayak ngepas saving syukur coba cari hasil samping teman
1231;pesan sandwich generation lupa bahagia suka uang habis butuh rumah semangat pantang serah jaga iya
1232;sehat sehat anak sandwich generation
1233;gaya orang rumah bahagia ibu ayah adi sehat sandwich generation percaya indah
1235;maaf iya tubatu anak sandwich generation beda pulau nyamperin
1236;sandwich generation keluarga harmonis hubung gala bunga matahari
1237;takutin takut gaji galebih sandwich generation
1238;yeah kasihan generasi muda indonesia banyak sandwich generation
1240;serius climbing bagus becanda weightlifting bagus fasilitas sandwich generation
1241;alangkah baik gaji rencana beli tumblr overpriced khas gen sandwich generation ibukota
1242;pagi ol lupa sarap tulang punggung keluarga alias sandwich generation butuh tenaga
1244;istilah sandwich generation sentimental bakti orang tua anjing
1246;vasektomi haram gapapa anak dibiayain anak hidup susah sandwich generation
1248;sehat juang sandwich generation moga lancar rezeki
1249;minggu gaji tunda undur tidak ada pegang sedihnyaa sandwich generation
1251;nikah gaji ujung cerai iya mubah biaya nikah nasib sandwich generation ekonomi negara buruk anak pikir gizi anak biar tumbuh cerdas stunting gimme lebih baik salary consider married
1252;hasil lupa syukur butuh hidup penuh sandwich generation fokus struglingnya meanwhile strugling langsung keluarga
1254;kadang sali sandwich generation tulang punggung umur muda senang tunda but tidak apa someday utamain keluarga ganti iya
1255;apa tolong jadi sandwich generation iya allah
1256;its easy goin thru this asa dekat ultah ovt usia pikir dunia sulit sandwich lapis legit generation senang lihat balas oh ksmaan oh laku
1257;kemarin rame gadis pendek tanda sandwich generation background keluarga mumpuni
1259;anak an sandwich generation hilang muda sesuai uang dikit dandan ala remaja teman
1261;dengar kakak gojek curhat blio kuliah kurang biaya blio sandwich generation hidup adik orang tua nenek rumah sangar blio semangat teman untung kuliah lulus
1264;tabung mudah sulit sandwich generation
1266;suami sandwich generation nikah umur tua sayang suka kalah setia asa emong tertawa
1267;kadang sedih rame qn meanwhile enggak bisa tonton kerja uang prioritasin sandwich generation
1268;miskin harap suami cukup sandwich generation egois
1270;biar sandwich generation financial freedom tolong remuk
1271;bapak tukang galon mamah irt kakak kakak ajar sandwich generation kerja parttimefulltime nambahin butuh hari iam uo ners already got kep top kampus bawah kemenkes
1272;cari mertua selesai cari suami sandwich generation
1273;way skena belanja edisi biaya hidup mahal destined be sandwich generation living jabodetabek
1274;nabung umur kakak settle sandwich generation biayain orangtuanya sembari nabung nikahrumah tangga salah tunggu mapan mantap nikah anak orang mending kere nekat nikah ajak sengsara
1276;moga orang bantu sandwich generation tau tau
1278;huhu tidak apa reward ngonten pakai bapa buka usaha semangat sandwich generation
1279;luar diprovide sandwich generation akuin susah minimal apresiasi butuh harga usaha
1280;orang tua mskn kali sandwich generation kaget orang tua manja anak
1281;orang tua sandwich generation putusin rantai pasti ulang hidup anak kelak
1282;orang tua miskin kali sandwich generation kaget orang tua manja anak
1283;gaji sandwich generation iya ludesss nikah
1284;benci being sandwich generation harap anak anak rasai inti
1285;bebas sandwich generation bantu brimoooo canggih banget
1286;nenek bibi jahat papah uang beban bikin keluarga bahagia senang jahat sandwich generation
1287;pikir buka toko sandwich nama sandwich generation
1288;mimpi nyata bebas sandwich generation bantu tabung bri brimo
1289;sandwich generation sakit iya maksud pendem gilir suruh psikiater bilang syukur cerita gilir ceritain tetang
1291;sehat sehat sandwich generation kerja bayar langsung bayarin utang orang tua
1294;negara asia lberkembang indonesia angkat kerja membludak tenaga kerja murah orang tua keluarga dukung anak alias sandwich generation batas usia tunjang angkat muda umr langgar
1295;sandwich generation tuntut orang tua
1296;sandwich generation gen samasama brain rot banyak main handphone
1299;habis gaji uang tip uang bagi keluarga iya dasar pina indonesia populasi indonesia sandwich generation ganggu visi indonesia emas ayo cari tau kelola
1300;nanggung sandwich generation nyembuhin trauma serba kurang
1301;kenapaaa iya tau saia sandwich generation gitu gaji ngepas heran tabung
1303;bau bau sender sandwich generation dips doa sender kuat
1304;omong orang duit gapaham sandwich generation
1305;sandwich generation jaya jaya jaya
1306;gen tidak tahu iya sandwich generation suka salah senang keluarga rumah
1307;gaji tanggal kere iya sandwich generation awoakwok nangiz jujur
1308;bapak stroke sandwich generation heran iya sandwich generation hidup hedon clubbing mobil mahasiswa semester
1309;ngerasin libur sebentar sandwich generation
1310;moga sandwich generation dunia sehat limpah rezekinyaaa biar senang amin
1311;anak pakai konsep perintah most likely orang peduli giver satu sandwich generation
1312;anak perempuan sandwich generation hubung
1313;peluk anak sandwich generation did welllll terimakasih
1315;iya mau iya tanggung biaya makan tinggal beli jalan teken generation sandwich nikah pikir malu kaluarga kacau bawa calon suami
1316;capek hidup keluarga patriark sandwich generation
1317;biar mental waras rumah anak kosan sial bilang anak kosan sandwich generation kasih beliau uang bulan iya dulunya cicil rumah tukar antem minggu
1318;bayang og usia anjing sandwich generation
1319;sadar reward cair pegang penuh oh sandwich generation butuh pakai gppa ikhlass moga digantiin allah swt
1320;nabung sandwich generation tambah ngidol jeket
1321;cocok sandar anak perempuan sandwich generation tulang punggung keluarga
1322;usia butuh butuh uang biaya hidup biaya rumah tangga nikah anak utang orang tua sandwich generation henti pikir perut perintah indonesia sick
1324;kasihan anak nanggung beban pikul sandwich generation apa anak dapat sakit kasihan
1325;kalo kasih anak ajaya jarak gajauh enggak mau bikin anak sandwich generation redacted
1326;kesal sandwich generation capekkk sayangg kelluargaku jujur sanggupp
1327;being adult suck anak perempuan keluarga broken rumah sandwich generation
1330;orang tua anak sandwich generation nafkah wlpn produktif
1331;culture kini terima nitipin anak peduli hari erti tingkat dual income more biaya hidup didik urgent ybs sandwich generation nasib anak konglomerat
1332;sandwich generation privilege tiket vip surga
1333;naikin angka anggur anjgg pikir orang orang sandwich generation bgstt
1334;anak sandwich generation isi pikir berisik iya
1335;anak bungsu sandwich generation gan nama jatuh timpa meteor
1336;sehatsehat anak tunggal sandwich generation
1337;bentuk sedih keputusanasaan tekan frase sandwich generation ulang kali orang keluh laku pejabatinstansi akhir line mentang mentang orang semenamena
1338;alas raya sandwich generation exol
1340;orangorang kasih semangat anak sulung sandwich generation anak bungsu tulang punggung keluarga disemangatin
1341;jujur kesal sandwich generation ribut uang asih pribadi branding keluarga hasil khawatir anggap uang
1342;sandwich generation mah lapis legit generation jatuh
1345;tertawa tempeleng dikit sender moga hidup rumah tangga baikbaik iya teman sandwich generation
1346;cepat cepat kerja gapapa sandwich generation orang tua tinggal hidup senang santai santai pikir biaya kerja keras didik
1347;pilih nomer okee sandwich generation
1350;teman kerja alpha girl smanya ambisius lomba pintar sandwich generation putus sekolah still awesome anda pya sempat kuliah fokus mimpi be more awesome
1351;tuju dapat zaman cari partner level finansial sandwich generation cicil lebih gaji user paylater
1352;untung sandwich generation biayain adik anak malak adik cowok iya waris usaha ebes jancuk rugi malak adekku
1353;menang sandwich generation bertanggungjawab ikhlas sabar iya uang kalah cukupin butuh adik ibukku bahagia
1355;kesal sandwich generation eh salah geprek generation maksud bahahaha bayang habis lahir butuh nanggung butuh finansial keluarga iya allah kuat suami moga gila
1356;enggak mau kakak sandwich generation enggak mau sandwich generation
1357;nu malaikat mah sandwich generation iya moal ajig moal kitu
1358;mah eweh eweh sandwich generation pamajikan jeung indung sarua priritas urang
1359;sumpah mati sandwich generationgbs enggak bisa
1361;ayo bikin budak korporat sandwich generation kerja banting tulang kayakaya
1362;takok seng genah mohon dapat sandwich generation
