;Stemming
2633;anak rungut siapa sandwich generation
2634;teman istri guru milik beban baca sandwichkegeprek generation tabung tahun ltjttahun suami tabung biaya tabung wajib zakat hasil selamat datang
2635;salarymu jtbln lajang sandwich generation kerja ind hidup baik habis uang iya senang nikmat hidup kerja keras staycation kluyuran keliling ind kuliner belanja barang brand mahal dsb
2636;this of most tone deaf ve ever baca nyala this aplikasi orang meni tanggunganmya keluarga baru sandwich generation kerja kasar dapat tahun juta coba kali main lihat
2637;tone deaf erti konsep sandwich generation
2638;google erti sandwich generation manis anjing pahit nyata babi
2640;qadarullah yatim piatu orang banyak salah sandwich generation emban tanggungjawab adikadik bilang kecilkecil
2641;nikah bwang syarat sandwich generation
2642;moga rezeki luas mudah sandwich generation ceuna
2643;dirasain sandwich generation moga sehat jiwa raga mental
2644;kakak uang butuh bujang meni tabung pasu sandwich generation
2645;buset kabar sandwich generation coba bikin polling iya puji tuhan hidup baikbaik
2646;minggu kemarin lebaran sisa jepang iri manusia single sandwich generation huhuu
2647;sandwich generation nepo baby cocok
2648;kerja ketemu tabung hutang cc sandwich generation keluar pola spending keluarga oke meet masuk kriteriaga henti situ
2649;kali dengar gerontology warga emas juta orang jaga kesihatan sehat umur travel consultancy business professional lingkar grup activities kos jaga kesihatan sandwich generation
2650;nikmat hasil kesabara upaya raih ridho berkah allah banyak syukur sandwich generation semangat besar hati allah enggak pernah bohong janji anak bakti
2651;temu suami cowok sandwich generation parah semenjak pandemi usaha bapak henti benerbener hidup paspasan biaya penuh butuh rumah kuliah adik
2652;nama sandwich generation gaboleh egois tutup rapat mimpimimpi janji anakanak gaboleh sandwich generation
2653;benci tulang punggung keluarga sandwich generation bikin trigger manusia manusia omong pinjam uang uang langit usaha
2654;single sandwich generation tidak apa usaha nabung pelan utang tanggung
2655;judul sekolah dana dokter spesialis mayoritas asal keluarga tengah susah lulus dokter kena nasib sandwich generation
2656;semangat pagi juang rupiah anak sulung sandwich generation bagi pikir keluarga
2657;hasrat thropy wife gebu ego anak sandwich generation tumpu harap orang tua adick mengijinkan kesal rebah rumah main twitter
2659;jujur keren sandwich generation tidak ada kalah
2660;sandwich generation suka biaya orang percaya jalan dunia akhirat
2661;kerja orangtua jatah omong sandwich generation taiii
2662;sandwich paksa orang bilang nikah sandwich generation ssokeyy sendiri bad
2665;cerita ebook launching kemarin big sandwich generation motivasi kerja keras dar kuliah jual keliling susu segar hasil produksi teman
2667;pandang sandwich generation tau rezeki alhamdulilah bagi orangtua rezeki bagi senang orangtua percaya allah buka jalan hamba usaha bagi
2669;moga anak gajadi sandwich generation
2670;anak perempuan bungsu hilang jaya orang tua kejar umur orang tua sandwich generation orang tua sepuh sehat turun otomatis anak bungsu enggak mau waaaah
2672;enak sandwich generation rumah kuat
2673;kesal iya sandwich generation agenshit
2674;kerja keras tanggung sandwich generation utang
2675;spending kuat tempel meni teman ngeluh suami sandwich generation spare uang bulan sisa juta proyeksi tumbuh depan iya puluh hidup bareng
2676;sandwich generation kenal pria mapan membiayain orang tua adik meni tanggung triple
2677;lanjur habis kena mental hmmm mantap anak sandwich generation
2678;traveling solo travel nyala biaya sandwich generation alhamdulilah traveling considering hobi mahal kesampen traveling tahun mikir traveling
2679;alas biaya hidup hasil iya segitu tekan sandwich generation sadar meni anak mahal alas twitku
2680;anak perempuan sandwich generation penuh butuh keluarga dapur internet dsb adik laki kadang butuh sekolah kakak dana kakak topup thats enggak pernah boros kpop facewash gunting habis
2681;hidup keluarga strict parent terap sandwich generation berat putus nikah jauh keluarga sumber uang pergi rumah
2682;sdih saudara sandwich generation sehat msi kerja malas kerja hmmz
2683;perempuan sandwich generation banding perempuan rumah orang tua milik luang rawat hobby jamin pergi orang tua
2684;harap doa kasih baik bikin anak sandwich generation kesal tau orang tua juang anak nanggung susah sesuai tinggal
2686;berekspektasi effort dapat sadar miskin jatuh cinta maklum sandwich generation fokus berani asa nikmat asa lega telah
2687;semangat iya sandwich generation luar moga tuhan balas bakti
2688;jarang tau sandwich generation nyokapjanda adik kelas sd mesti biayain tau nikah prioritas manusia
2689;iya inti cerita lebaran haru lihat amah dibutuhin keluarga keluarga nominasi sandwich kebab generation menang teman keluarga mah sekeluraga poros iwan
2690;tuntut pintar ranking menang lomba organisasi lolos sbm otak bisnis jalan tutup suram iya sandwich generation patriark
2691;nyata sandwich generation keluh buat orang huhu pantesan rezeki
2692;kuat bahu anak bungsu sandwich generation
2693;menang enggak bisa nabung gaji nyata sandwich generation kontol anak
2694;hrv sandwich generation lembur jam tongkat nabi musa
2696;orang keluh sandwich generation orang cenderung bebas sandwich generation
2697;orang sandwich generation hebat banget jir sehat umur keren
2698;semangat bestie sehat anak rantau sandwich generation rezeki lipat ganda
2699;kakak orang nikah lihat orang single omong tanggung putus meni pantas single ngalamin sandwich generation sabar kakak moga mudah urus
2700;ngentot jancuk kasihan kakak sandwich generation gara anjingggg
2701;nemu postingan instagram sandwich generation kolom komentar anak muda anggap wajar anggap upaya putus miskin struktural putus sandwich generation
2703;impi muda passive income biar tua anak rasai sandwich generation
2704;jujur kesal keluarga sandwich generation foyafoya andai mentingin keluarga banyak aset hidup enak
2705;sandwich generation kesal gaji bulan dik
2707;sandwich generation takut anti hopeless romantic tertawa
2709;omong orang lulus smk langsung kerja kuliah biaya sandwich generation beli rumah otw renov rumah beli motor uang less kumon adik bentar otw beli mobil kurang rendah orang
2710;sandwich generation harap thr titip nikmat
2712;amin iya allah kesal sandwich generation
2713;work renung gaji thr sisa juta alas diri sandwich generation beli bayar utang cicil
2714;sandwich generation sabar luas samudra hindia
2715;alas mahaaalllll kerja gaji langsung habis sandwich generation
2716;berat cuy risiko mental materi mending resin urus pribadi tau sandwich generation
2717;gais sandwich generation keluarga sandwich generation kantor tanggung beban pensiun jabat hehehehe amal gasihh gais
2718;mahal bangsat gaji nikah mahal beli rumah mahal sandwich generation hahahahahaha mati jink
2719;semenjak pandemi usaha rintis orang tua perlahan pudar adik sekolah masuk sandwich generation sosok tanggung beban lahir
2720;rangkap peran sandwich generation istri waras syukur tuntut arah sasar disalahin arah mata pisau chopper tajam salah
2721;takut iya know sandwich generation
2722;biaya hidup mahal lapang kerja sulit sandwich generation
2724;iya sandwich generation deserve pasang
2725;fyp baca twitter an meni sandwich generation salah calon sandwich generation bela enggak mau nikah sandwich generation
2726;guru enggak kuat gaji bulan sandwich generation banting stir kerja kantor alhamdulilah hidup cukup
2727;nikah selingkuh cari uang susah beli rumah mahal butuh primer mahal sehat bagus mahal didik kualitas mahal sandwich generation biayain keluarga susah tambah orang
2728;kriteria kakak emma masuk akal rokok miras alter fwb sandwich generation bare minimum anon sender bawa bawa value
2729;kakak ogi takut dicore kakak im breadwinner mum dad pisah kakak coret kakak hilang beban iya punya hilang im senang benar sandwich generation diancem coret kakak accept oke oke
2731;iya allah kakak rara meni sandwich generation peluk kakak moga kakak kuat lancar rezeki oppa aboji eomma cinta kakak sepenuh hati
2732;mari putus rantai sandwich generation
2733;pacar tau dosa langsung nikah meni sandwich generation tolak calon suami
2734;gaji umr jakarta manfaatin mampu bahasa inggris jerman omong sandwich generation rich orang
2735;kakak kasih tau alas tau sandwich generation nyata hidup lempeng cari cuan
2736;selesai ayo tutup sandwich generation hahahahah
2737;being sandwich generation being anak bungsu kalah apa but sisih uang beli bareng suka beli handphone mahal beli hias
2738;iya sandwich generation hehehe kadang mikir orang tua normalisasi balik peran kakak adik apresiasi ganti kakak
2739;bal main situ situ mending bacot anjing sandwich generation
2740;episode upin ipin kakak enggak mau kakak najis sedih lihat kakak ros figur anak gadis kakak independent sandwich generation parentless tulang punggung keluarga semangat
2741;percaya omong keliling sodaraku meni alas tante nemu cowok alesannya mapan nurunin another sandwich generation
2742;kesal sandwich generation harap hubung henti anak sakit
2743;tulang punggung sandwich generation sungguh diremehinnya
2744;belanja protes boros teriak kesal sandwich generation
2745;mikir enggak usah nikah iya biar duit nafkah orang tua nikah dosa butuh damping hidup anak anak sandwich generation mah mending enggak usah
2747;sandwich generation mamak bahagia belanja suka uang kasih lihat adeku polisi keluarga beban berkat allah mampu
2749;nahhhh jadi anak investasi kasihan anak sandwich generation sono
2752;sandwich generation biaya orang orang tahu jalan dunia akhirat
2753;gaji thr habis kejap pegang sandwich generation hhhh
2754;sandwich generation orang ngklaim finance stable hadir hati
2756;berkah pokok teman sandwich generation caregiver ganjar surga insyaallah
2757;oh sandwich generation umur tertawa otw gila
2758;especially punya oldest kakak tau segar lulus lulus pegawai negeri sipil instantly beban berat titip adik alias sandwich generation beliau umur iya umur
2759;kakak sandwich generation nanggung keluarga sesuai pulang bareng kakak kuliah tas jebol literally bolong bawah dijaitpenitiin rusak berani tau kondisi ekonomi
2760;nama paksa sandwich generation beda kuat lulus cari kerja uang hidupin keluarga anak bilang minimal oke kagak bilang program anak sarjana keluarga
2761;kesal sandwich generation orang bejonya tuh sulit hidup heran
2762;coba pikir gaji juta karyawan kota iya etis kena pajak juta sandwich generation anak tunggal
2763;nahloh sandwich generation rill masuk riset ahaha
2764;sandwich generation uang kasih orang tua
2765;thr numpang doang rekening sandwich generation keluarga jatah lanjut hidup senang dikit
2766;orangorang komen kerja tipikal orang pikir anak bawa rezeki kesiap finansial akibat sandwich generation
2767;ayo iya teman sukses usia muda laku anak konglo sandwich generation
2769;nyata sandwich generation semangattttt lelaki ku
2770;denial sandwich generation huhu sehat anak perempuansandwich generation
2772;beli rumah subsidi ah bagi kaum sandwich generation
2773;keluarga kalang bangsawan mah sandwich generation iya
2774;meanwhile orang gaji umr sesuai pas sandwich generation iya
2775;iya allah kuat anak sandwich generation guweh salah satu
2776;kaget orang tua pinjam pinjam online numpuk kaget orang tua acuh itujujur bingung im sandwich generation guess
2778;nyata pahit sandwich generation kabupaten
2779;sandwich generation bikin hidup tata
2780;sodara uang tolong sodara mana iya harepin lonely fighter peace sandwich generation
2781;welkom hidup sandwich generation kerja tapiii dah sehat
2782;teman sandwich generation kesal curhat pacar kesal kali asa tulang punggung orang tua lengkap kadang cowok kasihan lihat stres
2783;tolak sandwich generation tolak minta bantu aju
2785;parah duluan mikir buruk coba dekat orang langsung patah semangat tanggepan ketus pikir jual sandwich generation
2786;rada aman irt pasti pasang matang addiction pasti uang rencana pasti hubung keluarga just case buruk pulang pasti sandwich generation
2787;ambil rumah pay under umr sandwich generation titis minky momo mah kuat
2788;netflik sandwich generation aka nebeng sepupu nebeng ditebengjn ngaber lihat watching listnya romcom film dah
2789;isu problematik pasang selingkuh pasang kdrt mertua jahat sandwich generation tetangga julit masadepan sulit
2790;katai cowok sadar enak sandwich generation keluarga enak
2791;sender tau sandwich generation gaenak hitung keluarga
2792;halo dunia bentar kuliah kerja sandwich generation
2794;punya porno blocked kondisi stres keluarga ganggu normal takut alas cerita relieve stres oldest sandwich generation
2796;sandwich generation gaji bahagia langsung buka catetan tagih halaman
2797;susah nderr atur gaji sandwich generation hemat habis gaji moga sandwich generation rezeki biar butuh keluarga cukup
2798;work cewek gaji gaji umr sandwich generation atur gaji sender tengah habis uang
2799;semangat sandwich generation semangat cup cup cup
2800;dasar sandwich generation simpan api nyala mabro
2801;balada sandwich generation rerata pnh kecewa
2803;tech folks but wanna highlight this terima gagal buka mata apa muas harap orangorang beda cerita sandwich generation tekan keliling
2804;ajar adekku ajar nabung saham jago an bikin grup keluarga tiga disscus ajar adik bontot biar melek sandwich generation
2805;panggil sandwich gen bantu selesai skripsi kriteria perempuan jakarta jakarta sandwich generation link kuesioner terimakasih pokok
2806;temanteman suruh pindah rumah runyam sandwich generation keluarga keluarga pusing
2808;sepatu bally sandwich generation masa suka enak beli mahal seinget beli mahal mahal mimpi diadjust beli sneakers iya
2809;orang tua langsung biar adik sandwich generation
2810;sandwich generation tekan syukur generasi sandwich tekan barat utara timur selatan tenggara barat daya barat laut timur laut otw susul kasih tekan
2812;kayak sandwich generation big mac generation
2813;kucing ekor bilang sandwich generation
2814;sandwich generation gelut self reward
2815;semangat hubung inti semangat iya tidak apa ngeluh gitu juang sandwich generation
2816;work cewek curhat cewek gaji sedih honorer kantor pemerinan gaji under umr sandwich generation sender spd susah cari kerja nonguru nyangkut tolong doain moga sender lancar proses pindah
2818;jarang orang erti sandwich generation privilage semangat juang ujung sending virtual hug suka ipii
2819;kubur dalamdalam idealisme prinsip butuh sandwich generation
2820;sandwich generation thr iya wassalamualaikum
2821;pergi hehehe tumbuh keluarga orang mandiri sodara mandiri urus enggak bakal related ajak sandwich generation keluarga suami
2822;mun maneh milu nanggung butuh kolot jeung adik maneh enya maneh teh sandwich generation mun hasil maneh teu pakai jang milu nanggung
2823;kerja keras biar biaya pensiun kasihan anak sandwich generation
2825;tau keren teman sandwich generation adik mau dibeliin gaji herannyadia enggak pernah ngeluh duittau
2826;juta sandwich generation mah oke oke
2828;salah iya wrk sandwich generation kerja nikah
2829;sandwich generation alhamdulilah level tulang punggung keluarga
2830;mental miskin lekat gapapa moga hidup gengsi amin hidup sandwich generation
2831;minder senior meanwhile generasi rintis pegang gaji sandwich generation enggak bisa anjay
2832;jujur erti sandwich generation erti anak daru being girlboss tiring but tita
2833;sandwich generation im sugar son punya orang tua modalin aneh rezeki habis pusing uang darimana ah iya kerja asli pantau shopeetokopedia laughtalesports
2834;mana sandwich generation ketar tir bikin biaya april
2835;sehat sandwich generation moga waras
2836;sehat sehat anak sandwich generation
2837;teman hubung ayah kerja lahan anak sandwich generation butuh dana baik finansial keluarga butuh ditulisin cerita puisi chat terima kasih
2839;goks sandwich generation semangat kakak ilmu hitam nyala api abang
2840;sandwich generation orang asih orang tua sekian pasu triggering sadar orang asih pasu orang tua
2841;semangat sandwich generation tuhan rencana indah
2842;kakak tipe orang tua jadi anak sandwich generation
2843;tante anak kerja kerja perempuan doang laki nikah bikin anak anak bungsu perempuan ngabisin uang mbak another level of sandwich generation kasihan sepupu dia sukarela sapi perah
2845;juta dikumpulin tahun kumpul tipis tipis syarat sandwich generation butuh cover orang tua skincare treatment beli baju pakai uang
2846;iya allah tolong kabul doa sandwich generation iya allah
2847;iya allah gaksi sandwich generation
2848;mbak nyata sandwich generation gatega lulus kuliah tanggung mbaakku yaaampun bimbang
2849;mikir enak iya middleton lahir keluarga cantik ajar nikah pangeran tau sandwich generation berita edar sadar hidup mudah
2850;adik enggak usah ngamuk asa hidup berat pusing serba salah sandwich generation gedig pala adik
2851;benerbener iri orang mapan sandwich generation
2853;sehat single mom sandwich generation pakai tameng kencang
2854;anak sandwich generation sulit iya lang timbang egois semangat
2855;penuh dukung dudu sandwich generation
2856;jelang kelapa uji financial berat berani mikir depan ngandelin gaji bulan butuh gaji samping ritme samping konsisten sandwich generation madep
2857;anak enggak bakal sandwich generation hahaa hidup kadang kidding
2858;kesal sandwich generation enggak punya uang keluarga butuh
2859;im punya broke af era tidak tahu oh tuhan sandwich generation
2860;sandwich generation asa sandwich generation
2861;sedih khawatir ayah tani kelapa sawit harga suka turun ngotak sandwich generation irt calon guru keluarga tengah alias bayangno isi kaum diskriminasi tertawa
2862;kesal ngejar orang hindar mending fokus cari uang sandwich generation
2863;cinta sayang habis makan sayang keluarga harga allah adab terima mata perempuan sempurna sandwich generation oke realita tuntut mapan
2864;urus orang tua gitu sandwich generation kah konsep sayang orang tua
2865;rava kesini zaman beda sandwich generation kerja banting tulang nyekolahin adikadik
2866;tuju boomer pegang prinsip anak rezeki sesuai anak lahir dibebanin anak hasil anak sandwich generation
2867;boomer borong aset disupport sandwich generation aset borong kemanaaaaaa
2868;sadar teryata sandwich generation kali beasiswa cair
2870;anak mati kerja banting tulang anak sandwich generation nyerah dapatin hidup sambung jadi dorong nyerah invest invest beli aset
2871;kesal sandwich generation kuras jiwa raga tuhan mah mati muda
2872;tanyarl sender sandwich generation sender kesal orang tua uang obrolin ubah kadang sender respon kadang tega sender mesti iya asih sender butuh
2873;sehatsehat anak sandwich generation adik tidak tahu
2874;gantle awat muka wash andal sandwich generation eksfoliasi jugamakin hemat
2875;susah sandwich generation wulan wulan mesti ngeluu
2876;sandwich generation tanggung anak sulung
2877;sisi kakak sandwich generation ngerawat topang ekonomi keluarga stres lampias nglampiasin marah pokok semangat iya teman moga orang tua sehat rezeki lancar amin
2879;sandwich generation umur gin kerja stabil adik bahagia ekspektasi capai jabat nikah mobil dan bagai bawah
2880;tos kakak umur gin tabung segitu sandwich generation nikah teman pintar fashion tampil alakadarnya yasudah nikmat
2881;anak sandwich generation biayain agens adik
2884;alesannya beli kumpul uang iya sandwich generation uang pakai urus perlu orang tua adik
2885;pikir sandwich generation pikir tanggung beaar nikah ubah pikir pikir egois hidup
2888;anak bakti orang tua konsep ngawur sadar sandwich generation waris waris calon anak bijak atur uang tua
2889;sandwich generation hasil dik orangtua sayang anak belabelain jual mobil jual rumah sekolah sang anak apa didik sang anak anak lulus sukses sadar uang tabung habis
2890;kalo benar sandwich generation moga hati ikhlas fisik kuat moga mudah iya allah
2891;announced kerja tutup akhir jujur butuh info loker bayar kuliah butuh rumah nasib sandwich generation bjir
2892;kakak kakak sandwich generation sehat sehat iya lancar rejekinyaa ehehehe kemarin tas expect kasih pumpung nikah kakak nomer
2893;nunda tepat cwk sandwich generation tunggu adik selesai sekolah
2894;sandwich generation kesal kerja duit pakai keluarga gaji gaji jarang pakai butuh
2895;anjing frugal living sandwich generation
2896;bagus nderr drama keluarga sandwich generation
2897;gantung tuju dewasa aset milik sandwich generation tanggung tabung iprit calon orang mending sok nikah hamil muda benalu teman single
2898;sedih realize benar sandwich generation
2899;pensiun uang pensiun tip cadang pasu langsung oh sandwich generation
2900;sandwich generation minimal gaji bulan juta
2902;tida gaya hidup hedon sandwich generation based nyala alam pribadi
2903;juta kerja dom biaya hidup lumayan rendah sandwich generation tinggal orang tua aktif kerja tuntut asih orang tua wajib bantu keluar rumah bantu makan orang tua
2904;cowok sandwich generation kakak selesai
2905;topang ekonomi sandwich generation sulung saudara
2906;saran juang sandwich generation ujung juang cinta ujung
2907;ikhtiar angkat harkat derajat keluarga sandwich generation musti fokus angkat beban maslahat sehat pikir gym gegayaan doang
2908;bodoh ngepost ngiklan anugerah teman orang tua mandiri post mati kaum sandwich generation
2910;urg mikir sandwich generation teh beban teh sempat anjing teh kasih sempat bakti orang tua kesan paksa
2911;netek rasai keras hidup ngejudge orang sandwich generation
2912;moga rezeki lancar iya work beban kakak sender sandwich generation ringan alhamdulilah kerja jalan moga niat cari uang keluarga berkah salah cita sender
2913;sayang posting berani lihat instagram story strugglenya orang tua toxic sandwich generation mending diam orang background selesai masalah
2914;kebab sandwich kakak sandwich generation iya bawang bombay irisandaun bawang mayonaise dsb
2915;kaum tengah jadi sandwich generation negara
2916;double sandwich generation huhu teman moga sadar keluarga kakak tanggung jawab moga sehat rezeki lancar
2917;iya inti pasang provider sandwich generation nikah sandwich generation mah ripuh cuy uwehehehee
2918;moga sandwich generation untung kakak rara temu erti hidup keluarga bismillah disholawatin
2919;bahas seringkali kontekstual arah sandwich generation anak jepit biaya keluarga bangun depan topik cakup luas
2920;hidup nikmat kabupaten mall bioskop hidup senin sabtu pagi sore tonton konser cold main snapgram isyana tuan belas kunto aji sandwich generation biaya adik kuliah perlu dapur
2921;nasip anak rantau sandwich generation cheeeeckkk
2922;uang pensiun karyawan andelin bpjs siap uang pensiun bantu anak cucu berantas muncul sandwich generation
2923;sandwich generation enak anjjj capeee capeee
2924;citacita putus rantai sandwich generation tua repot keluarga tinggal pakai sakit ngerepotin keluarga tinggal utang
2925;balada orangorang sok agam beban sandwich generation qodirun alal kasbi mandiri hasil gantung orang kakak salah aspek pribadi muslim
2926;balada orang sok agam beban sandwich generation qodirun alal kasbi mandiri hasil gantung orang kakak salah aspek pribadi muslim
2927;orang tua adik nangisin mandiri jadi kakak sandwich generation
2928;habis sahur menang sedih juang cowok mikirnya nikah umur sandwich generation heres punya man anak pikir nikah keluarga stable rumah
2929;haloo gaiss budgeting omong sandwich generation rumah kontrak pegawai kontrak bekas cicil payleter galbayers budgeting terap
2930;jujur sandwich generation mudah lelah lepas sulit kesal
2931;atas bahas kpr kpr bcz katai parasit salah iya tara rumah sandwich generation pensiun activeamppassive income sumbu pendek baca bagi suami uang
2932;sandwich generation berat iya allah
2933;keluarga omong temenmu sandwich generation dik line an
2934;keringetan kesal tau sandwich generation cuy rill limpah
2936;sandwich generation tertawa kesal uang alir doang asa
2937;cewek sandwich generation mahasiswa tingkat cowok old uang pimpin usaha
2938;gaji kelah beban sandwich generation
2939;sandwich generation semangat iya iya allah iya allah
2942;kerja gaji hidup layak angkat beban sandwich generation nabung
2943;wanita salah satu finansial dilahirin keluarga highly privilege sandwich generation prioritasin keluarga nemu cocok provide dukung
2946;iya allah baca rumah sweet loan triggering uras emosi kesal menang gara gregetan ngebayangin sandwich generation entuh
2947;urus tua smpi mati jamin uang pensiun tabung sandwich generation level
2949;tahu sistem simbah iya sandwich generation kakak tua nguliahin adeknya tenang after tahu sepupu sandwich makmur waris limpah
2950;anak tunggal sandwich generation huft
2951;heran sederhana kalimat paham eeeh ngegass spok mpe katai ibu bodoh offside mana anak sandwich generation gampang emosi
2952;bikin ketrigger tahan kerja salah satu cepat putus rantai sandwich generation anak depan
2953;iya anak perkara finasial prepare nabung didik anak anak zaman kebaya nikah umur gin anak berti maksa anak sandwich generation
2954;sandwich generation prahara hambat indonesia emas
2955;trueeee sandwich generation aset apaapa retweet juta kali
2956;hai terimakasih hadiah butuh laptop butuh punya rusak keadaanya sandwich generation biaya sisih gaji keluarga ukt kuliah
2957;gantung orang anak sandwich generation zaman adikadiknya rame pol baris bar adik sambung hasil anak istri anak meni mulus depends
2958;gaji bawah umr sandwich generation ahahah jgnkan nabung jajan kadang anja
2959;aneh fine fine untung masuk sandwich generation rumah tangga tenang orang tua asih bebas enak sesuai anak anak asa raja cucu
2960;kasihan kejar gaji umk naik biaya hidup biaya bahan pokok roket gaji umk sandwich generation
2961;blio sandwich generation hitung alias pelit umur itungannya muda ukur nikah cowok giniya moga ktm sesuai kriteria ktm yasudah
